id;description_RU;description_EN
intro.1;Вот мы и в новом доме! Пока никто не пришел, проверь, все ли на месте. Выбери в книге рецепт зелья силы и закинь в котел нужные ингредиенты.
intro.2;Надеюсь, здесь будет спокойнее, чем в прошлом городе. И мы здесь никому не помешаем. Давай пока сварим чаю! Смешай крапиву с белладонной и добавь шампиньон для аромата.
intro.3;Приветствую тебя на новом круге! Кажется, мы все это уже проходили. Как говорится, делай что должно, и будь что будет. Загляни в нашу книгу, она все помнит. Давай что-нибудь сварим!
Painter_1;Я художник, мое имя известно многим! В последнее время творения не радуют меня. Ушла из них жизнь, ушло очарование. Дай что-нибудь, что можно в краску подмешать, чтобы они стали лучше!
Curse_Potion_Villager;Кузнец наш мне жизни не дает — как напьется, каждый раз с кулаками нападает. Дай мне что-нибудь, чтобы жизнь ему подпортить! Только не смертельное — не хочу грех на душу брать.
Healing_Potion_Villager;В бане поскользнулся вчерась, да об лавку треснулся. Голова до сих пор раскалывается, да какие-то тени мерещатся все время. Облегчи боль как-нибудь.
Healing_Potion_Worker;Дерево не в ту сторону повалилось, еле отскочить успел, но зацепило меня. Ребра болят, помоги!
Horserace1;Я на скачки хочу лошадь свою выставить. Но конкурент у меня есть сильный. Хочу ослабить кобылку его. В награду тебе бабушкин рецепт подарю, она первой красавицей слыла.
Love_Potion_Villager;Привет, соседушка! Я тут себе муженька, наконец, подобрала. Да только он от женушки своей уходить никак не хочет. Помоги по-соседски, а? Она все равно его не ценит.
Strength_Potion_Worker;Слушай, доченька. Я уже совсем старый стал, не могу с молодежью тягаться в шахте. Не хочу, чтобы думали, что слабак. Есть у тебя что-нибудь, чтобы силу мне вернуть?
bard;Последние дни у меня что-то не ладится с выступлениями в местных тавернах. Дай-ка мне что-нибудь, что я смогу подлить в бочку с брагой, чтобы меня заметил народ и не скупился на похвалы и монеты.
blind-1;Прости за беспокойство. Глаза мои уже не те, что раньше. Я зашел на чудесный запах, что доносился из твоего дома. Дай-ка отведать варева, что состряпала!
devil.1;Отлично справляешься, милая, страху навела в округе, любо-дорого посмотреть! Может, чего новое попробуем? Смешай-ка {0}, {1} и {2}.
inquisition.1;Слухи о твоем мастерстве разнеслись повсюду. Свари мне свое лучшее зелье, и я награжу тебя по достоинству.
mushroom-story.1;Держу постоялый двор у тракта. От гостей отбоя нет! Но, видать, сглазил кто-то – посреди делянки с шампиньонами выполз из земли «ведьмин круг»! Строчки, поганки, мухоморы – тьфу! Вытравить бы его.
Beauty_Potion_Wealthy_Villager;Завтра свататься поеду, а там семейка высокородная, не уверен, что с легкостью согласятся. Сделай меня краше и лучше!
Poison_Potion_Villager;Мы тут хряка растим на конкурс, а в соседней деревне свинья в два раза жирнее и злее. Нечистая скотина, точно тебе говорю. Нужно прикончить её, пока хозяев не сожрала!
Bird_Keeper_1;Здравствуй, доченька. У меня с голубями напасть какая-то. То почту медленно доставляют, то вообще летать не хотят. Может, ты мне какое-нибудь пойло для них дашь?
Gardener;Доброго здравия вам, уважаемая! В саду, за которым я присматриваю, завелись жучищи вредные. Всю зелень портят! Вывести не могу. Помогите, а?
Herald;Здравствуй, ведьма. Помоги, а? У меня голос пропал, а без него работать не могу — я глашатай местный. Думал, что из-за простуды, но лекарства не помогают никак.
Peasant_Bear;Доброго здоровьица тебе, колдунья. Поспорил я по пьяни, что медведя голыми руками заборю. Отказываться от слова не могу — негоже это. Дай что-нибудь для храбрости аль для силушки?
boot_climber;А навари мне, умелица, чего-нибудь, чтобы силы прибавилось или клейкости. Хочу на ярмарке по столбу за сапогами залезть. Моя обувка прохудилась давно, промочу ноги и помру.
nest_harvester;В лесах дичь бить запретили, за рыбу вовсе плетьми выпороть могут. Пухнем с голоду, мать! Помоги хоть до птичьих гнезд на скалах добраться! На них пока запретов нет.
old_knight-1;Милостивая госпожа, я прибыл инкогнито. Тело мое слабеет и рука не так тверда, но сердце просит последнего турнира. Верни мне былое, хотя бы ненадолго, чтобы выступил достойно и ушел на покой.
succub_issue;Слушай, замучила меня демоница распутная! Каждую ночь приходит – и того! Я уже еле встаю по утрам… Что? Прогнать? Ты сбрендила? Дай зелье, чтобы помогутнее я стал!
zolotar;Здеся алхымии разводят? Я навозу принес. Свежак! В лопух завернул. В золото переколдуем? Я навоз ношу, ты чаруешь. Богатеями станем! Чего морду кривишь? Хоть зелье дай, сам управлюсь.
Doctor_1;Мое призвание — помогать людям, как и ваше! Мне нужно ампутации людям делать, а они этим недовольны. Возражают, так сказать. Поделитесь чем-нибудь, чтоб мои клиенты в забытье впали?
WakeCultist_1;Здравствуйте, уважаемая. Мне бы, это... средство какое-нибудь для, э-э-э, хозяина. Спит он много слишком. Что-нибудь бы, чтобы пробудить его от древнего... в смысле, взбодрить, так сказать.
witch-memory-1;Прошлое не дает мне покоя. Это все моя вина. Если бы я только... Хоть сделанного не воротишь, а забыть не могу.
alcohol_healer;Сети ставил надысь, а вода холодная, ни одна жаба в такую не полезет! Чихаю теперь – изба трясется. Но еликсиров не приму! Дай чего покрепче, чтоб слезу вышибало.
Family-feud;Мы с тестем как выпьем, так спорим до красных ушей! Жена сказала, еще раз сцепимся – выгонит обоих. Навари мне такого, чтобы и вякнуть не мог! Я себя знаю – не удержусь ведь.
philosopher;Мыслитель я. В бочке жил, в горы уходил, в болоте сидел, а постичь суть мира так и не смог. Жена работать гонит, а разве истину в работе сыщешь? Навостри мне ум или супу дай хотя бы.
Portrait_issue;Портретист ко мне едет. А я как глянусь в зеркало – так и в слезы! Годы никого краше не делают. Хочу хоть на день помолодеть, а потом вместо зеркала на портрет глядеть стану.
sculptor;Повелели мне принцессе статую выточить. Да вот беда – не успеваю. Зело объемная уродилась девица! Дай питья, чтобы спать не хотелось, ночами работать буду, а то повесят меня.
stolen_rooster_1;Здравствуй, кудесница. Замучили меня… кхм… женихи, вот! Дай что-нибудь, чтобы вместо меня страшилу какую-нито видели, обходили за три дороги. Некогда мне женихаться, хозяйство ждет.
Children_First;Здравствуйте, многоуважаемая ведьма! Не проклинайте нас, пожалуйста. А вы правда волшебные зелья варите? А дайте нам зелье, чтобы корова голосом человеческим говорила!
Children_Second;Наш друг пытался доказать, что локоть лизнуть может, и руку себе поломал. Спор он выиграл, но ему так домой нельзя — родители прибьют. Можете вылечить его?
Fool_laughter;Приветик, коллега! Скучные тут люди, никто шуток не понимает, окажи помощь собрату по профессии, а? Хочу местных развеселить, унылые какие-то они все.
Memory_Potion_Soldier;Доброго тебе дня, колдунья. Я уже пару лет, как с войны вернулся, но до сих пор не могу забыть всех ужасов, что пережил. Сделай с этим что-нибудь, умоляю!
Sleep_Villager;Слушай, родная. Ко мне брат в гости приехал пару дней назад, я с тех пор уснуть не могу. Храпит так, что печь трясется. Дай что-нибудь, чтобы его вырубило хорошенечко.
Wake_potion_apples;У меня яблоки ворует кто-то, а я поймать не могу — только солнце сядет, сразу засыпаю. Отгони сон на пару дней. Коли воришку поймаю — премного благодарен буду.
mary.1;Ага, ты должно быть та ведьма, о которой все говорят! Моему отцу нужно лекарство — голова раскалывается, аж жуть. Я заплачу!
Memory_Potion_Hunter;От меня жена ушла к другому. Сколько ни упрашивал — возвращаться не хочет, прям светится вся. Водкой её из памяти стереть не могу. Может, ты поможешь?
Sleep_Potion_Children;У одного старичка местного яблок — целый сад. А он ими не делится и даже продавать не хочет, дни напролет караулит. Пусть он поспит чуть-чуть, а мы и тебе яблочек принесем!
mary.5;Услышала, как какие-то подозрительные типы спорили, настоящая ты ведьма или нет. Сказала им, что ты моя выжившая из ума тетушка. Вот умора, а?
mary.6;Уму непостижимо, что только люди о тебе не болтают! Винят во всех бедах. А ты ж хорошая, я-то знаю. Ну, я им устрою такое, быстро рты позатыкают!
mary.7;У них под носом лучшая на свете ведьма, а они тебя в упор не замечают! Не боись, я всем твое мастерство расхвалю.
mary.8;Слыхала, как люди-то тебя поносят? Называют старой никчемной каргой. А ведь ты настоящая колдунья. Я что-нибудь придумаю, чтоб они языки завязали!
mary.9;Знаешь... я всегда хотела быть как ты. Силой волшебной обладать. Вознестись над всеми. Может... сваришь что-нибудь особое, только для меня?
inquisitor.2;Я тебя насквозь вижу. Много таких, как ты, повидал. От правосудия тебе не скрыться, сама знаешь. А пока завари мне чайку.
Wake_Potion_Merchant;Мне в дорогу дальнюю нужно ехать завтра, товары в город везти. А там лес дремучий и долгий. Хочу пересечь как можно быстрее, да боюсь уснуть. Поможешь?
tavern;Замучил меня и постояльцев певец этот, как его! Не даёт покоя своими песенками и прибаутками. Не могу отвадить. Помоги забыть ему дорогу в мой трактир.
mushroom-story.3;Не помогло твое средство от грибного круга! Давай еще попробуем, а то, чую, сам зарасту грибами по самые уши, и дело мое сгинет.
old_knight-2;Слухи о твоем мастерстве не лгут! Я был подобен падающей скале, и ни один противник не устоял передо мной. Теперь я жажду победы вновь! Не скупись, ведьма, подавай лучшее питье!
Strength_Potion_Merchant;Я на ярмарку крупную собираюсь, но боюсь, что лошаденка моя старая не утащит телегу со всем товаром. Можешь дать что-нибудь, чтобы живости ей придать?
Bandit.1;Солдаты местного лорда ищут меня за то, что мы с парнями раздавали его деньги бедным. Помоги мне, ведьма!
Tax_Collector.1;Я приехал к вам налоги собирать. Помоги обобрать местных, и я в долгу не останусь.
Strength_Potion_Villager;Что-то я слабым стал совсем в последнее время. Молот еле поднимаю, меха качать не могу. Верни мне силу мою, ведьма!
ChildrenOfBlacksmith;У нас папка помер недавно — кузнецом был, не слышали? Мы уверены, что его старый знакомый траванул — он сильно батю не любил, завидовал ему. Отомстить хотим! Помогите!
Curse_Potion_Village_Second;Снова здорово! Кузнец наш и вовсе дьяволом сделался. Колотит меня, что ни есть мочи. Делай теперь меня тоже могучим, может, хоть так смогу осадить его.
Healing_Potion_Villager2;Благодарствую, голова моя прошла, только все мерещится что-то, тени мелькают какие-то. Тревожат они меня, уж не умом ли я тронулся.
Healing_Potion_Villager_Final;Дивное зелье ты мне дала, тени я смог разглядеть. Смотрю, а это черти рогатые шастают ко мне в подвал с кружками, брагу мою воруют, окаянные! Подсоби от них избавиться, век не забуду!
Sick_Animal_Villager;Доброго здоровья, ведунья. Скотинка моя захворала, дай для нее лекарство какое.
Unlove_Potion_Villager;Эта стерва у меня мужика увела магией черной. Сам-то он даже смотреть на нее не стал бы. Верни мне мужа! Знаю, ты в этом виновата!
blind-6;Я хоть и слеп, но иной раз больше других вижу. Не хочешь нажить беду — вари-ка лучше супы да чай.
blind-2;Как чудно пахнет! Я слышал, тут потчуют на славу. Удиви же меня!
blind-3;О! Говорят, тут можно дивных напитков отведать. Дай-ка чего-нибудь... особенного.
devil.2;Атмосфера у тебя в городе просто восхитительная! Будь так любезна, свари кое-что для меня. Просто смешай {0}, {1} и {2}.
mushroom-story.4;Вызнал, что грибница бормочет. Оказывается, зарыли на моей делянке убитого грибника, а тому под землей тесно стало, гложет его голод… Ты смешай грибочков разных. Накормим бедолагу.
mushroom-story.2;Не помог твой яд. Мало того – грибной круг шире стал. Теперь внутри зверушки дохлые лежат. А из-под земли бубнит кто-то, стонет и охает…
WakeCultist_1_Failed;Что-то не очень ему помогло ваше варево. Я просил что-нибудь, чтобы взбодриться. Вот принес полуживую летучую мышь, попробуй ее положить.
witch-memory-12;Я виновата во всем, лишь я. Зачем, зачем... Вернуть бы все назад. Этот судьбоносный миг, он навсегда останется в моей памяти.
witch-memory-2;Я помню, как мы гуляли среди вереска. Твою улыбку. Твои песни. Цветы, что ты собрал для меня. Все как во сне...
stolen_rooster_5;Умыкнули у меня петуха золотого! Удачу приносил – любое дело с ним спорилось. Знаю, соседка это. Помоги вернуть пропажу! Твое ремесло виновато, чую. Обманешь – донесу.
stolen_rooster_2;Замучила соседка-неумеха. Ферме сладу не даст, а петуха моего счастливого выкрасть хочет! Придет – гони в шею. А мне подай чего бодрящего. Устала, пока дошла до тебя.
Children_Third;У нас отец уже который месяц пьет, не просыхает ни на день. Нам да матушке достается сильно, никак управу на него найти не можем. Может хоть вы поможете?
Fool_1;Привет, подруга! Давай мельника разыграем? Ты меня замаскируешь, а я подкараулю его на складе и мукой обсыплю с ног до головы. Вот уморительно будет!
mary.2;Как здорово, когда рядом настоящая ведьма живет! Ты поди и летать умеешь? А где твоя метла? Тебе подарить?
Chameleon_Hunter;Что-то я будто охотиться разучился — следы не узнаю, звери меня за версту чуют. А раньше ведь лучшим охотником был! Подсоби, а? Я тебе какую-нибудь шкурку красивую принесу!
devil.6;Еще одна рыбка угодила в невод. Славно сработано, дорогуша! А теперь смешай {0}, {1} и {2}.
inquisitor.3;Не увиливай. Мне все твои делишки известны. Гореть тебе... в адском пламени ли, на костре ли святом. Но от огня не уйдешь. Давай, показывай, что там в котле у тебя.
old_knight-3;Было трудно, но я одолел противников и пробился в полуфинал. Но, чую, не сладить мне с самыми искусными бойцами. И снова взываю к твоему ремеслу, желая стать чемпионом.
Chameleon_Potion_Soldier;Нам приказано выследить бандитов в соседнем лесу. Уж очень они стали прытки! Есть у тебя что-нибудь подходящее?
Chameleon_Bandit_RobTaxCollector;Слыхала, сколько деньжищ нынче у сборщика налогов? Мы его подстеречь хотим, да изъять себе. Спрячешь нас от его глаз? Добычей поделимся.
Painter_2;Это снова я! В прошлый раз все отлично удалось. Давно мои картины так меня не радовали. Давай еще раз провернем, добавим какое-нибудь зелье в них?
Healing_Potion_Villager3;Снова я к тебе. Да голова-то не болит больше. А пятна в глазах остались, так и мелькает что-то черное, точно мыши бегают. Тревожно мне, помоги тени разглядеть.
Love_Potion_Villager_Third;Никак он со мной остаться не может, всё равно домой возвращается. Дай мне еще бутылочку! Не могу видеть, как он с этой стервой живет.
blind-5;Какой необычный ресторан! Если б не мой друг, я б никогда... А что у вас в меню?
blind-4;Какой необычный бар! Если б не мой друг, я б никогда... Что нальете?
devil.3;Всегда рад тебя видеть, красавица! Попробуй бросить в котел {0}, {1} и {2}.
Bird_Keeper_2;Здорово ты помогла с голубями, век не забуду! Пришел к тебе от имени королевского сокольничего. Его питомцы перестали приносить добычу. Поможешь ему?
Doctor_2;В прошлый раз ты мне здорово помогла! Сделаешь мне теперь какую-нибудь штуку для лечения людей? Хочу понять, как они у тебя работают, да может и сам чего-нибудь перенять смогу
WakeCultist_2;Приветствую, о могущественная. К вам тут друг мой заходил, просил средство для хозяина. Ну взбодрить там его, растормошить. Понравилось оно ему, можете еще сделать?
