id;description_RU;description_EN
intro.1;Вот мы и в новом доме! Пока никто не пришел, проверь, все ли на месте. Выбери в книге рецепт зелья силы и закинь в котел нужные ингредиенты.
intro.2;Надеюсь, здесь будет спокойнее, чем в прошлом городе. И мы здесь никому не помешаем. Давай пока сварим чаю! Смешай крапиву с вербяткой и добавь шампиньон для аромата.
intro.3;Приветствую тебя на новом круге! Кажется, мы все это уже проходили. Как говорится, делай, что должен, и будь, что будет. Загляни в нашу книгу, она все помнит. Давай что-нибудь сварим!
Curse_Potion_Villager;Кузнец наш мне жизни не дает — как напьется, каждый раз с кулаками нападает. Дай мне что-нибудь, чтобы жизнь ему подпортить! Только не смертельное — не хочу грех на душу брать.
Horserace1;Я на скачки хочу лошадь свою выставить. Но конкурент у меня есть сильный один. Хочу ослабить кобылку его. В награду тебе рецепт своей бабушки подарю, она первой красавицей слыла.
Healing_Potion_Villager;В бане поскользнулся вчерась, да об лавку треснулся. Голова до сих пор раскалывается, да какие-то тени мерещатся все время. Облегчи боль как-нибудь.
Love_Potion_Villager;Привет, соседушка! Я тут себе муженька, наконец, подобрала. Да только он от женушки своей уходить никак не хочет. Помоги по-соседски, а? Она все равно его не ценит.
bard;Последние дни у меня что-то не ладится с выступлениями в местных тавернах. Дай-ка мне что-нибудь, что я смогу подлить в бочку с брагой, чтобы меня заметил народ и не скупился на похвалы и монеты.
devil.1;Отлично справляешься, милая, страху навела в округе, любо-дорого посмотреть! Может чего новое попробуем? Смешай-ка {0}, {1} и {2}.
inquisition.1;Слухи о твоем мастерстве слышны повсюду. Свари мне свое лучшее зелье, и я награжу тебя по достоинству.
Beauty_Potion_Wealthy_Villager;Завтра свататься поеду, а там семейка высокородная, не уверен, что с легкостью согласятся. Сделай меня краше и лучше!
Children_First;Здравствуйте, многоуважаемая ведьма! Не проклинайте нас, пожалуйста. А вы правда волшебные зелья варите? А дайте нам зелье, чтобы корова голосом человеческим говорила!
Poison_Potion_Villager;Мы тут хряка растим на конкурс, а в соседней деревне он в два раза жирнее и злее. Нечистая скотина, точно тебе говорю. Нужно прикончить её, пока их самих не сожрала!
Adventurers_1;Мы отправляемся в дальний путь, чтобы одолеть злобного колдуна. Почти все собрали, решили к тебе на дорожку зайти. Дай нам зелье, чтобы раны лечить.
Bird_Keeper_1;Здравствуй, доченька. У меня с голубями напасть какая-то. То почту медленно доставляют, то вообще летать не хотят. Может, ты мне какое-нибудь пойло для них дашь?
blind.1;Прости за беспокойство. Глаза мои уже не те, что раньше. Я зашел на чудесный запах, что доносился из твого дома. Дай-ка отведать твоего варева!
Fool_laughter;Приветик, коллега! Скучные тут люди, никто шуток не понимает, окажи помощь собрату по профессии, а? Хочу местных развеселить, унылые какие-то они все.
Healing_Potion_Worker;Дерево не в ту сторону повалилось, еле отскочить успел, но зацепило меня. Ребра болят, помоги!
Strength_Potion_Worker;Слушай, доченька. Я уже совсем старый стал, не могу с молодежью тягаться в шахте. Не хочу, чтобы думали, что слабак. Есть у тебя что-нибудь, чтобы силу мне вернуть?
Doctor_1;Мое призвание — помогать людям, как и ваше! Мне нужно людям ампутации делать, а они этим недовольны. Возражают, так сказать. Поделитесь чем-нибудь, чтоб мои клиенты в забытье впали?
Painter_1;Я художник, мое имя известно многим! В последнее время творения не радуют меня. Ушла из них жизнь, ушло очарование. Дай что-нибудь, что можно в краску подмешать, чтобы они стали лучше!
WakeCultist_1;Здравствуйте, уважаемая. Мне бы, это... средство какое-нибудь для, ээээ, хозяина. Спит он много слишком. Что-нибудь бы, чтобы пробудить его от древнего... в смысле, взбодрить, так сказать.
witch-memory.1;Все из-за меня. Это все из-за меня. Какой же дурой я была... Хоть сделанного не воротишь, а забыть не могу.
Sleep_Villager;Слушай, родная. Ко мне брат в гости приехал пару дней назад, я с тех пор уснуть не могу. Храпит так, что печь трясется. Дай что-нибудь, чтобы его вырубило хорошенечко.
Gardener;Доброго здравия вам, уважаемая! В саду, за которым я присматриваю, завелись жучищи вредные. Всю зелень портят! Вывести не могу. Помогите, а?
Herald;здравствуй, ведьма. помоги, а? у меня голос пропал, а без него работать не могу - я глашатай местный. думал, что из-за простуды, но лекарства не помогают никак.
Peasant_Bear;Доброго здоровьица тебе, колдунья. Поспорил я по пьяни, что медведя голыми руками заборю. Отказываться от слова не могу — негоже это. Дай что-нибудь для храбрости аль для силушки?
mary.1;Ага, ты должно быть та ведьма, о которой все говорят! Моему отцу нужно лекарство — голова раскалывается, аж жуть. Я заплачу!
Fool_1;Привет, подруга! Давай мельника разыграем? Ты меня замаскируешь, а я подкараулю его на складе и мукой обсыплю с ног до головы. Вот уморительно будет!
Memory_Potion_Hunter;От меня жена ушла к другому. Сколько ни упрашивал — возвращаться не хочет, прям светится вся. Водкой её из памяти стереть не могу. Может, ты поможешь?
Sleep_Potion_Children;У одного старичка местного яблок — целый сад. А он ими не делится и даже продавать не хочет, дни напролет караулит. Пусть он поспит чуть-чуть, а мы и тебе яблочек принесем!
Memory_Potion_Soldier;Доброго тебе дня, колдунья. Я уже пару лет, как с войны вернулся, но до сих пор не могу забыть всех ужасов, что пережил. Сделай с этим что-нибудь, умоляю!
Wake_potion_apples;У меня яблоки ворует кто-то, а я поймать не могу — только солнце сядет, сразу засыпаю. Отгони сон на пару дней. Коли воришку поймаю — премного благодарен буду.
Fool_2;Здравствуйте, уважаемая зельеварка! Мне нужно от вас зелье, чтобы лягушкой притворится. Есть у нас один рыбак, который меня недолюбливает, хочу посмеяться над ним.
mary.5;Услышала, как какие-то подозрительные типы спорили, настоящая ты ведьма или нет. Сказала им, что ты моя выжившая из ума тетушка. Вот умора, а?
mary.6;Уму непостижимо, что только люди о тебе не болтают! Винят во всех бедах. А ты ж хорошая, я-то знаю. Ну, я им устрою такое, быстро рты позатыкают!
mary.7;У них под носом лучшая на свете ведьма, а они тебя в упор не замечают! Не боись, я всем твое мастерство расхвалю.
mary.8;Слыхала, как люди-то тебя поносят? Называют старой никчемной каргой. А ведь ты настоящая колдунья. Я что-нибудь придумаю, чтоб они языки завязали!
mary.9;Знаешь... я всегда хотела быть как ты. Силой волшебной обладать. Вознестись над всеми. Может... сваришь что-нибудь особое, только для меня?
Curse_Potion_Village_Second;Ты зачем кузнецу силу вернула? Он опять за старое взялся. Делай теперь меня тоже могучим, может хоть так смогу осадить его
Bandit.1;Солдаты местного лорда ищут меня за то, что мы с парнями раздавали его деньги бедным. Мне нужно спрятаться!
Tax_Collector.1;Я приехал к вам налоги собирать. Помоги обобрать местных, и я в долгу не останусь.
Strength_Potion_Villager;Что-то я слабым стал совсем в последнее время. Молот еле поднимаю, меха качать не могу. Верни мне силу мою, ведьма!
ChildrenOfBlacksmith;У нас папка помер недавно — кузнецом был, не слышали? Мы уверены, что его старый знакомый траванул — он сильно батю не любил, завидовал ему. Отомстить хотим! Помогите!
Sick_Animal_Villager;Доброго здоровья, ведунья. Скотинка моя захворала, дай для нее лекарство какое.
Healing_Potion_Villager2;Благодарствую, голова моя прошла, только все мерещится что-то, тени мелькают какие-то. Тревожат они меня, уж не умом ли я тронулся.
Healing_Potion_Villager_Final;Дивное зелье ты мне дала, тени я смог разглядеть. Смотрю, а это черти рогатые шастают ко мне в подвал с кружками, брагу мою воруют, окаянные! Подсоби от них избавиться, век не забуду!
Unlove_Potion_Villager;Эта стерва у меня мужика увела магией черной. Сам бы он даже смотреть на нее не стал бы. Верни мне мужа! Знаю, ты в этом виновата!
tavern;Замучил меня и постояльцев певец этот, как его! Не даёт покоя своими песенками и прибаутками. Не могу отвадить. Помоги забыть ему дорогу в мой трактир.
devil.2;Атмосфера у тебя в городе просто восхитительная! Будь так любезна, свари кое-что для меня. Просто смешай {0}, {1} и {2}.
inquisitor.2;Я тебя насквозь вижу. Много таких, как ты, повидал. От правосудия тебе не скрыться, сама знаешь. А пока завари мне чайку.
Wake_Potion_Merchant;Мне в дорогу дальную нужно ехать будет завтра, товары в город везти. А там лес дремучий и долгий. Хочу пересечь как можно быстрее, да боюсь уснуть. Поможешь?
Adventurers_2;А мне - что-нибудь, что прятаться поможет. Не люблю, когда меня враги видеть могут
blind.6;Я хоть и слеп, но иной раз больше других вижу. Не хочешь нажить беду — вари-ка лучше супы да чай.
blind.2;Как чудно пахнет! Я слышал, тут потчуют на славу. Удиви же меня!
blind.3;О! Говорят, тут можно дивных напитков отведать. Дай-ка чего-нибудь... особенного.
WakeCultist_1_Failed;Что-то не очень ему помогло ваше варево. Я просил что-нибудь, чтобы взбодриться. Вот принес полуживую летучую мышь, попробуй ее положить.
witch-memory.2;Я помню, как мы гуляли среди вереска. Твою улыбку. Твои песни. Цветы, что ты собрал для меня. Все как во сне...
mary.2;Как здорово, когда рядом настоящая ведьма живет! Ты поди и летать умеешь? А где твоя метла? Тебе подарить?
Fool_1_healing;Не сработало варево твое. Мельник увидел и тумаков надавал. Вылечи меня, а то всем нажалуюсь, что никудышная из тебя ведьма!
Chameleon_Hunter;Что-то я будто охотиться разучился — следы не узнаю, звери меня за версту чуят. А раньше ведь лучшим охотником был! Подсоби, а? Я тебе какую-нибудь шкурку красивую принесу!
Fool_2_healing;Что-то как-то не так оно сработало. Рыбак меня по голосу узнал, да пнул пребольно. Лечи теперь!
devil.6;Еще одна рыбка угодила в невод. Славно сработано, дорогуша! А теперь смешай {0}, {1} и {2}.
Chameleon_Potion_Soldier;Нам приказано выследить бандитов в соседнем лесу. Уж очень они стали прытки! Есть у тебя что-нибудь подходящее?
Strength_Potion_Merchant;Я на ярмарку крупную собираюсь, но боюсь, что лошаденка моя старая не утащит телегу со всем товаром. Можешь дать что-нибудь, чтобы живости ей придать?
Chameleon_Bandit_RobTaxCollector;Слыхала сколько деньжищ сборщик налогов собрал? Мы его подстеречь хотим, да изъять себе. Спрячешь нас от его глаз? Добычей поделимся.
Healing_Potion_Villager3;Снова я к тебе. Да голова-то не болит больше. А пятна в глазах остались, так и мелькает что-то черное, точно мыши бегают. Тревожно мне, помоги тени разглядеть.
Love_Potion_Villager_Third;Никак он со мной остаться не может, всё равно домой возвращается. Дай мне еще бутылочку! Не могу видеть, как он с этой стервой живет.
devil.3;Всегда рад тебя видеть, красавица! Попробуй бросить в котел {0}, {1} и {2}.
inquisitor.3;Не увиливай. Мне все твои делишки известны. Гореть тебе... в адском пламени ли, на костре ли святом. Но от огня не уйдешь. Давай, показывай, что там в котле у тебя.
Adventurers_3;Я бы хотел что-нибудь, чтобы с одного удара этого колдуна свалить мог. Терпеть не могу всех этих волшебников... Ничего личного, ладно?
Bird_Keeper_2;Здорово ты помогла с голубями, век не забуду! Пришел к тебе от имени королевского сокольничьего. Его питомцы перестали приносить добычу. Поможешь ему?
blind.5;Какой необычный ресторан! Если б не мой друг, я б никогда... А что у вас в меню?
blind.4;Какой необычный бар! Если б не мой друг, я б никогда... Что нальете?
Doctor_2;В прошлый раз ты мне здорово помогла! Сделаешь мне теперь какую-нибудь штуку для лечения людей? Хочу понять, как они у тебя работают, да может и сам чего-нибудь перенять смогу
Painter_2;Это снова я! В прошлый раз все отлично удалось. Давно мои картины так меня не радовали. Давай еще раз провернем? Дай еще чего-нибудь!
WakeCultist_2;Приветствую, о могущественная. К вам тут друг мой заходил, просил средство для хозяина. Ну взбодрить там его, растормошить. Понравилось оно ему, можете еще сделать?
WakeCultist_1_Failed2;Не то ты варишь, ведьма! Нам нужно то, что пробудит мертвого. Друзья подсказали, грибок этакий нужен. Который в суп кладут.
witch-memory.3;Как ты мог? После всего, что между нами было? Бросил меня? Посмеялся надо мной? Единственный в жизни шанс, и ты его упустил.
mary.3;Шла мимо и решила заглянуть. Может, по дому чем помочь? Или с твоим... варевом? Давай почудим!
Beauty_Hunter;Отменное у тебя зелье вышло! Знаешь, дома пустовато как-то одному. Я тут присмотрел себе бабу, но не знаю, как подобраться к ней получше. Есть выпить чего-нибудь для этого дела?
Healing_Potion_Bandit;Ранили меня сильно. Спаси меня, ведьма. Я денег не пожалею!
Unlove_Potion_Villager_Third;Ненормальная! Сколько можно семью мою пытаться порушить! Верни мне моего мужа, его душа принадлежит мне!
devil.4;Скучала по мне, душечка? А уж я-то как скучал! Смешай {0}, {1} и {2}.
witch-memory.4;Выбор сделан и скреплен кровью. Теперь ты останешься со мной навсегда. В печали и в радости. Да, котеночек? Теперь ты счастлив?
mary.4;Ты так добра! Мне всегда хотелось самой... а, неважно. Я в лес иду, может, и для тебя каких травок пособирать? Нужно чего?
Love_Potion_Hunter;Спасительница моя! Я той женщине понравился, но она какую-то чепуху несет. «Не хочу все испортить» и бла-бла. Слышал, что у тебя привортные зелья есть. Поделись, век буду благодарен!
Memory_Potion_Villager;Никак он со мной оставаться не хочет, даже твои проклятые зелья не помогают. Не могу я жить без него. Убери его из памяти моей!
Doctor_3;И снова привет! Мне нравится, как у нас с тобой работа идет. Я слышал, ты можешь делать людей сильнее — наверное, мышцы у них растут быстрее или еще что-то. Дай попробовать для науки?
Painter_3;Я чувствую, как шедевр зреет внутри меня. Это будет самая потрясающая картина во всем мире! Но неграмотные люди могут не понять всей её глубины. Поможешь сделать так, чтобы её любили все?
WakeCultist_3;Доброго дня тебе, хранительница темных знаний. Ты уже очень помогла нам. Немного нашему хозяину осталось, чтобы довести свои дела до конца. Дай же в третий раз то зелье, что пробудит мертвого!
Doctor_4;Слушай, я тут понял. Если мы объединим знания, то сможем не только лечить! Главная проблема — чтобы плоть стала свежей и молодой. Помоги! У меня есть свежий труп, на нем испробую!
