id;description_RU;description_EN
Strength_Potion_Villager;Что-то я слабым стал совсем в последнее время. Молот еле поднимаю, меха качать не могу. Верни мне силу мою, ведьма!;I've grown too weak and frail in my old age. Can barely lift my hammer and pump the bellows these days. Help me get my strength back, witch!
ChildrenOfBlacksmith;У нас папка помер недавно — кузнецом был, не слышали? Мы уверены, что его старый знакомый траванул — он сильно батю не любил, завидовал ему. Отомстить хотим! Помогите!;Our daddy died recently — he was a smith, maybe you knew him? Anyways, we're sure his old friend poisoned him — he was jealous and harbored grudges. We want revenge!
Curse_Potion_Village_Second;Снова здорово! Кузнец наш и вовсе дьяволом сделался. Колотит меня, что ни есть мочи. Делай теперь меня тоже могучим, может, хоть так смогу осадить его.;Heard you'd helped the smith get his strength back. Why the hell would you do that? Now he thrashes me on the regular again. Now you must make me as tough as he is, so I'll have a fighting chance.
Healing_Potion_Villager2;Снова я к тебе. Да голова-то не болит больше. А пятна в глазах остались, так и мелькает что-то черное. Слыхал, ягодка одна есть, для зрения шибко полезная. Нет ли ее у тебя в запасе, пошукай?;Can't thank you enough for curing my headaches. Although I'm still having visions and seeing furtive shadows. Heard there is a forest berry that's very good for the eyes. Do you happen to have it?
Healing_Potion_Villager_Final;Дивное зелье ты мне дала, тени я смог разглядеть. Смотрю, а это черти рогатые шастают ко мне в подвал с кружками, брагу мою воруют, окаянные! Подсоби от них избавиться, век не забуду!;What a wonderful potion did you give me! My sight pierced shadows and I finally saw their true forms. Pixies snooping around my cellar and stealing my beer! I'll be eternally grateful if you help me get rid of them.
Sick_Animal_Villager;Доброго здоровья, ведунья. Скотинка моя захворала, дай для нее лекарство какое.;Wishing you good health, witch. My livestock fell ill, got any remedies?
Unlove_Potion_Villager;Эта стерва у меня мужика увела магией черной. Сам-то он даже смотреть на нее не стал бы. Верни мне мужа! Знаю, ты в этом виновата!;That bitch stole my husband using black magic! He never even noticed her before! Give him back, I know it's your fault!
blind-6;Я хоть и слеп, но иной раз больше других вижу. Не хочешь нажить беду — вари-ка лучше супы да чай.;I may be blind but my blind eyes see what others cannot. You should stick with food and drinks if you know what's good for you.
blind-2;Как чудно пахнет! Я слышал, тут потчуют на славу. Удиви же меня!;Extravagant smells! I was told you were making exquisite dishes here! Surprise me!
blind-3;О! Говорят, тут можно дивных напитков отведать. Дай-ка чего-нибудь... особенного.;Ah! I was told you were making exquisite drinks here! I want to try something... unique.
devil.2;Атмосфера у тебя в городе просто восхитительная! Будь так любезна, свари кое-что для меня. Просто смешай {0}, {1} и {2}.;Nicely done, I can feel the terror in your town from afar. Would you kindly brew something for me? Just mix {0}, {1} and {2}.
mushroom-story.4;Вызнал, что грибница бормочет. Оказывается, зарыли на моей делянке убитого грибника, а тому под землей тесно стало, гложет его голод… Ты смешай грибочков разных. Накормим бедолагу.;I've figured out what the shrooms were trying to say. Turns out someone buried a murdered mushroom-picker there. He hungers. Let's feed him a mix of mushrooms.
mushroom-story.2;Не помог твой яд. Мало того – грибной круг шире стал. Теперь внутри зверушки дохлые лежат. А из-под земли бубнит кто-то, стонет и охает…;The poison didn't work. Even worse, the fairy ring got wider. Now I keep finding dead critters inside. And it seems that someone's muttering and moaning underneath...
WakeCultist_1_Failed;Что-то не очень ему помогло ваше варево. Я просил что-нибудь, чтобы взбодриться. Вот принес полуживую летучую мышь, попробуй ее положить.;Doesn't look like your brew worked properly. Again, I wanted some pick-me-up. Here, try putting in this bat, it should help.
witch-memory-121;Я виновата во всем, лишь я. Зачем, зачем... Вернуть бы все назад. Этот судьбоносный миг, он навсегда останется в моей памяти.;I am the one to blame for all this. Why, oh why... If only I could turn back time. That fateful moment, burned forever in my memory.
witch-memory-2;Я помню, как мы гуляли среди вереска. Твою улыбку. Твои песни. Цветы, что ты собрал для меня. Все как во сне...;I remember us walking through heather field. Your smile. Your songs. Flowers you gave me. It all seems like a dream now.
stolen_rooster_5;Умыкнули у меня петуха золотого! Удачу приносил – любое дело с ним спорилось. Знаю, соседка это. Помоги вернуть пропажу! Твое ремесло виновато, чую. Обманешь – донесу.;My golden rooster was stolen! He brought me luck and now he's gone. I know it's that girl next door. Help me get it back! I can smell your hand behind it. Trick me on your own peril.
stolen_rooster_2;Замучила соседка-неумеха. Ферме сладу не даст, а петуха моего счастливого выкрасть хочет! Придет – гони в шею. А мне подай чего бодрящего. Устала, пока дошла до тебя.;My good-for-nothing neighbor is such a bother. All she wants is to steal my lucky rooster. Kick her out if she ever comes asking for help, you hear me? Now, make me some refreshments, got tired from walking.
Children_Third;У нас отец уже который месяц пьет, не просыхает ни на день. Нам да матушке достается сильно, никак управу на него найти не можем. Может хоть вы поможете?;Our daddy’s drinking like a fish. Hasn't been sober in months. He beats mother and us something awful. Maybe some of your brews can help?
Fool_1;Привет, подруга! Давай мельника разыграем? Ты меня замаскируешь, а я подкараулю его на складе и мукой обсыплю с ног до головы. Вот уморительно будет!;Hello, friendo! Let's prank the miller! I wanna hide in his storeroom and shower him with flour. It'll be hysterical!
mary.2;Как здорово, когда рядом настоящая ведьма живет! Ты поди и летать умеешь? На метле? А покажи, как ты летаешь, ну пожалуйста!;It's so awesome to have a real witch around! I bet you can even fly! Everyone knows witches float on broomsticks! Let me see you fly, pretty pretty please!
Chameleon_Hunter;Что-то я будто охотиться разучился — следы не узнаю, звери меня за версту чуют. А раньше ведь лучшим охотником был! Подсоби, а? Я тебе какую-нибудь шкурку красивую принесу!;I lost my hunting knack — can’t read the tracks and prey eludes me. I used to be the best hunter around! Help me, and I’ll get you some nice furs.
devil.6;Еще одна рыбка угодила в невод. Славно сработано, дорогуша! А теперь смешай {0}, {1} и {2}.;Another fly in the web. Nice work, baby! Mix {0}, {1} and {2}.
inquisitor.3;Не увиливай. Мне все твои делишки известны. Гореть тебе... в адском пламени ли, на костре ли святом. Но от огня не уйдешь. Давай, показывай, что там в котле у тебя.;Don't fool around. I know what you're up to. You will burn... In a holy fire or in hell. You. Will. Burn. Now, what do you have in that cauldron?
old_knight-3;Было трудно, но я одолел противников и пробился в полуфинал. Но, чую, не сладить мне с самыми искусными бойцами. И снова взываю к твоему ремеслу, желая стать чемпионом.;It was tough but I did it. Every opponent fell before my might. Now I'm against the very best and I don't think I'm up to the task. I am once again calling on your skill and craft in hopes of becoming a champion.
Chameleon_Potion_Soldier;Нам приказано выследить бандитов в соседнем лесу. Уж очень они стали прытки! Есть у тебя что-нибудь подходящее?;We've been ordered to hunt bandits hiding in the local forest. They've been getting too bold and troublesome. Got anything we can use?
Chameleon_Bandit_RobTaxCollector;Слыхала, сколько деньжищ нынче у сборщика налогов? Мы его подстеречь хотим, да изъять себе. Спрячешь нас от его глаз? Добычей поделимся.;Heard about all the money the taxman collected? It’ll only be just to...er... expropriate it. Let’s play a little hide’n’seek and you’ll get your cut.
Painter_2;Это снова я! В прошлый раз все отлично удалось. Давно мои картины так меня не радовали. Давай еще раз провернем, добавим какое-нибудь зелье в них?;Me again. What a smashing success! I don't remember the last time painting brought me such joy. Let's do it one more time!
Healing_Potion_Villager3;Снова я к тебе. Да голова-то не болит больше. А пятна в глазах остались, так и мелькает что-то черное, точно мыши бегают. Тревожно мне, помоги тени разглядеть.;I come again asking for your help. My head is okay, thanks. Yet I still see little black spots, like mice scuttling around. It bothers me a great deal, help me clear my sight.
Healing_Potion_Villager31;Не помогло варево твое, все мелькание вижу вкруг себя. В лес вышел, молиться начал, да на поганочку и наткнулся. Ты поганочку замешай, а то к кому мне еще податься, горемыке?;I still see little black spots, like mice scuttling around. I went to the woods and prayed, and my sight fell upon the little toadstool. Try putting it into your cauldron, you're the one bound to help me.
Love_Potion_Villager_Third;Никак он со мной остаться не может, всё равно домой возвращается. Дай мне еще бутылочку! Не могу видеть, как он с этой стервой живет.;Why must he go home, why can’t he just stay with me? Get me another drop, I can’t bear him living with that bitch!
blind-5;Какой необычный ресторан! Если б не мой друг, я б никогда... А что у вас в меню?;What quaint little inn! If not for a friend of mine I would never… What do you have on the menu?
blind-4;Какой необычный бар! Если б не мой друг, я б никогда... Что нальете?;What quaint little pub! If not for a friend of mine I would never… What do you have on the tap?
devil.3;Всегда рад тебя видеть, красавица! Попробуй бросить в котел {0}, {1} и {2}.;Always a pleasure to see you, doll! Try to add {0} to {1} and {2}.
Bird_Keeper_2;Здорово ты помогла с голубями, век не забуду! Пришел к тебе от имени королевского сокольничего. Его питомцы перестали приносить добычу. Поможешь ему?;Great work with those pigeons! Now I come at the behest of royal falconer. His pets can't catch any prey lately. Can you help?
Doctor_2;В прошлый раз ты мне здорово помогла! Сделаешь мне теперь какую-нибудь штуку для лечения людей? Хочу понять, как они у тебя работают, да может и сам чего-нибудь перенять смогу;Your last potion helped me a lot. Now, can you make an actual healing potion? I must understand how they work, maybe I can replicate this effect.
WakeCultist_2;Приветствую, о могущественная. К вам тут друг мой заходил, просил средство для хозяина. Ну взбодрить там его, растормошить. Понравилось оно ему, можете еще сделать?;Greetings, oh mighty one. You've met a friend of mine, he asked for a pick-me-up for our master. He liked it a great deal, can you make another?
WakeCultist_1_Failed2;Не то ты варишь, ведьма! Нам нужно то, что пробудит мертвого. Друзья подсказали, грибок этакий нужен. Который в суп кладут.;Wrong brew, witch. We need something that can wake you up from the deepest slumber. I heard there's a mushroom that can help. An edible one.
witch-memory-3;Как ты мог? После всего, что между нами было? Бросил меня? Посмеялся надо мной? Единственный в жизни шанс, и ты его упустил.;How could you? After all we've been through? Ditch me? Laugh at me like that? Once-in-a-lifetime chance, thrown away like garbage?
stolen_rooster_3;Скажу начистоту – про женихов соврала. Горе меня душит. Соседка обратила петухом моего суженого! Дай снадобье в помощь! Я петушка выкраду и расколдую поцелуем.;I gotta come clean with you - I lied about suitors. I'm mad with grief. My neighbor turned my beloved into a rooster. Help me steal him so I could dispel the evil charm with a kiss.
stolen_rooster_4;Обворовала меня, титька козья! Прикинулась работником – и стащила петуха. Ты ей помогла-таки? Ну, тогда научи, как отыскать уворованное, а то я на тебя инквизиции донесу!;She stole from me, you goat tit! Mimic'd a worker somehow and took off with MY rooster. You aided her, didn't you? Either you help me get it back or face the inquisition. Your choice.
Fool_2;Здравствуйте, уважаемая зельеварка! Мне нужно зелье, чтобы лягушкой притвориться. Есть у нас один рыбак, который меня недолюбливает, хочу посмеяться над ним.;Greetings, oh potion maker! II want to turn me into a frog. There is a fisherman who isn’t very fond of me, I’m gonna prank him severely.
Fool_1_healing;Не сработало варево твое. Мельник увидел и тумаков надавал. Вылечи меня, а то всем нажалуюсь, что никудышная из тебя ведьма!;Your brew was no good! The miller saw me and gave me a thrashing. Cure me, or I’ll tell everyone what a lousy potion maker you are.
mary.3;Шла мимо и решила заглянуть. Может, по дому чем помочь? Или с твоим... варевом? Давай почудим!;Just passing by. Do you need any help? Around the house? Maybe I could help you with some… mixing? Let's mix something crazy!
Beauty_Hunter;Отменное у тебя зелье вышло! Знаешь, дома пустовато как-то одному. Я тут присмотрел себе бабу, но не знаю, как подобраться к ней получше. Есть выпить чего-нибудь для этого дела?;Your potion worked splendid! Tell you what, my house feels empty sometimes. A girl caught my eye but that's a prey I never learned how to stalk. I’m sure you have something for it.
Healing_Potion_Bandit;Ранили меня сильно. Спаси меня, ведьма. Я денег не пожалею!;I've got a nasty wound. Save me, witch. You won't regret this, promise!
Unlove_Potion_Villager_Third;Ненормальная! Сколько можно семью мою пытаться порушить! Верни мне моего мужа, его душа принадлежит мне!;Are you nuts?!? Stop trying to destroy my family! My husband’s soul belongs to me!
devil.4;Скучала по мне, душечка? А уж я-то как скучал! Смешай {0}, {1} и {2}.;Did you miss me, sweetheart? I certainly did! Mix {0}, {1} and {2}.
witch-memory-4;Выбор сделан и скреплен кровью. Теперь ты останешься со мной навсегда. В печали и в радости. Да, котеночек? Теперь ты счастлив?;I've made my choice, and sealed it with blood. You will stay with me forever. Share my burden. Yes, my dear kitty? Are you happy now?
Fool_2_healing;Что-то как-то не так оно сработало. Рыбак меня по голосу узнал, да пнул пребольно. Лечи теперь!;Guess something went wrong. The fisherman recognized my voice and kicked me real hard in the groin. Cure me now!
mary.4;Ты так добра! Мне всегда хотелось самой... а, неважно. Я в лес иду, может, и для тебя каких травок пособирать? Нужно чего?;You are so nice! I've always wished I could… Nevermind. I'm going to the woods, can look for some herbs as well. Do you need some?
Love_Potion_Hunter;Спасительница моя! Я той женщине понравился, но она какую-то чепуху несет. «Не хочу все испортить» и бла-бла. Слышал, что у тебя приворотные зелья есть. Поделись, век буду благодарен!;You’re my saviour! The girl liked me, but she keeps on babbling something about “not-wanting-to-bungle-it-up-again”. They say you can make love potions, is it true? Care to brew me one?
Painter_3;Я чувствую, как шедевр зреет внутри меня. Это будет самая потрясающая картина во всем мире! Но неграмотные люди могут не понять всей её глубины. Поможешь сделать так, чтобы её любили все?;With my mind's eye I can see a masterpiece taking shape. It will be my magnum opus, the greatest painting ever! But I fear the masses are too ignorant to appreciate the grand design. Help me strike them with awe!
Memory_Potion_Villager;Никак он со мной оставаться не хочет, даже твои проклятые зелья не помогают. Не могу я жить без него. Убери его из памяти моей!;He just keeps going back, your vile concoctions are no help! I can’t live without him. Say what, get him out of my mind!
Doctor_3;И снова привет! Мне нравится, как у нас с тобой работа идет. Я слышал, ты можешь делать людей сильнее — наверное, мышцы у них растут быстрее или еще что-то. Дай попробовать для науки?;Hello again. I like our collaborative effort. Heard you can make people stronger - probably by promoting muscle growth or lowering inhibitions if I care to guess. Got a sample, for science?
WakeCultist_3;Доброго дня тебе, хранительница темных знаний. Ты уже очень помогла нам. Немного нашему хозяину осталось, чтобы довести свои дела до конца. Дай же в третий раз то зелье, что пробудит мертвого!;Good day to you, oh keeper of arcane arts. Your assistance was most appreciated. Soon our master will bring the matters to the end. Thrice we ask for a potion of awakening, and thrice it we'll acquire!
Doctor_4;Слушай, я тут понял. Если мы объединим знания, то сможем не только лечить! Главная проблема — чтобы плоть стала свежей и молодой. Помоги! У меня есть свежий труп, на нем испробую!;Now I finally understand. With our combined knowledge we can go beyond healing. We just need to solve the problem of rejuvenation and reinvigorating the flesh. A potion, posthaste! While the cadaver is still fresh!
bastard-1;Мой господин устал от чужого внимания и хочет ненадолго сменить личину. Будет тебе, ведьма, золото и слава, но – учти! Спрос тоже большой.;My lord got weary with excessive attention his person draws, and desires to refashion his fair visage for a spell. Riches and glory will be yours, witch, if you deliver.
bastard-2;К тебе намедни мой посыльный приходил, зелье для смены личины просил, а ты бурду сварила какую-то. И мы оба чуть голов не лишились! Продай то, что просим, иначе всем худо будет.;My man came to you the other day, asking for a face-changing potion. And you made him some glop, which was not very wise. Give us what we want or you will pay dearly.
bastard-3;Господин, что оказал тебе доверие – бастард предыдущего короля. Злить его опасно. Лучше помоги ему подтвердить чистоту крови! Ответ скрыт в летописях, да как его отыщешь без зелья?;The lord who'd honored you with his trust is the late king's bastard. A dangerous man to cross. Just help him prove his claim. I need to stay focused while I ponder the ancient texts in the royal archive.
bastard-4;Лекарь не зря тебя хвалил. Брат короля отыскал легенду о древней зачарованной чаше, что чует королевскую кровь. Помоги ее найти. Один из королей-полудурков подарил ее младшим родичам.;The doctor was right about you! The king's brother discovered a legend of an ancient enchanted chalice that only answers to one of the blood. We need to find it. One of the mad kings gave it away to some distant relatives
bastard-42;Лекарь не зря тебя хвалил. Брат короля отыскал легенду о древней зачарованной чаше, что чует королевскую кровь. Помоги ее найти. Один из королей-полудурков подарил ее младшим родичам.;The doctor was right about you! The king's brother discovered a legend of an ancient enchanted chalice that only answers to one of the blood. We need to find it. One of the mad kings gave it away to some distant relatives
