id;description_RU;description_EN
WakeCultist_1_Failed2;Не то ты варишь, ведьма! Нам нужно то, что пробудит мертвого. Друзья подсказали, грибок этакий нужен. Который в суп кладут.
witch-memory-3;Как ты мог? После всего, что между нами было? Бросил меня? Посмеялся надо мной? Единственный в жизни шанс, и ты его упустил.
stolen_rooster_3;Скажу начистоту – про женихов соврала. Горе меня душит. Соседка обратила петухом моего суженого! Дай снадобье в помощь! Я петушка выкраду и расколдую поцелуем.
stolen_rooster_4;Обворовала меня, титька козья! Прикинулась работником – и стащила петуха. Ты ей помогла-таки? Ну, тогда научи, как отыскать уворованное, а то я на тебя инквизиции донесу!
Fool_2;Здравствуйте, уважаемая зельеварка! Мне нужно зелье, чтобы лягушкой притвориться. Есть у нас один рыбак, который меня недолюбливает, хочу посмеяться над ним.
Fool_1_healing;Не сработало варево твое. Мельник увидел и тумаков надавал. Вылечи меня, а то всем нажалуюсь, что никудышная из тебя ведьма!
mary.3;Шла мимо и решила заглянуть. Может, по дому чем помочь? Или с твоим... варевом? Давай почудим!
Beauty_Hunter;Отменное у тебя зелье вышло! Знаешь, дома пустовато как-то одному. Я тут присмотрел себе бабу, но не знаю, как подобраться к ней получше. Есть выпить чего-нибудь для этого дела?
Healing_Potion_Bandit;Ранили меня сильно. Спаси меня, ведьма. Я денег не пожалею!
Unlove_Potion_Villager_Third;Ненормальная! Сколько можно семью мою пытаться порушить! Верни мне моего мужа, его душа принадлежит мне!
devil.4;Скучала по мне, душечка? А уж я-то как скучал! Смешай {0}, {1} и {2}.
witch-memory-4;Выбор сделан и скреплен кровью. Теперь ты останешься со мной навсегда. В печали и в радости. Да, котеночек? Теперь ты счастлив?
Fool_2_healing;Что-то как-то не так оно сработало. Рыбак меня по голосу узнал, да пнул пребольно. Лечи теперь!
mary.4;Ты так добра! Мне всегда хотелось самой... а, неважно. Я в лес иду, может, и для тебя каких травок пособирать? Нужно чего?
Love_Potion_Hunter;Спасительница моя! Я той женщине понравился, но она какую-то чепуху несет. «Не хочу все испортить» и бла-бла. Слышал, что у тебя приворотные зелья есть. Поделись, век буду благодарен!
Painter_3;Я чувствую, как шедевр зреет внутри меня. Это будет самая потрясающая картина во всем мире! Но неграмотные люди могут не понять всей её глубины. Поможешь сделать так, чтобы её любили все?
Memory_Potion_Villager;Никак он со мной оставаться не хочет, даже твои проклятые зелья не помогают. Не могу я жить без него. Убери его из памяти моей!
Doctor_3;И снова привет! Мне нравится, как у нас с тобой работа идет. Я слышал, ты можешь делать людей сильнее — наверное, мышцы у них растут быстрее или еще что-то. Дай попробовать для науки?
WakeCultist_3;Доброго дня тебе, хранительница темных знаний. Ты уже очень помогла нам. Немного нашему хозяину осталось, чтобы довести свои дела до конца. Дай же в третий раз то зелье, что пробудит мертвого!
Doctor_4;Слушай, я тут понял. Если мы объединим знания, то сможем не только лечить! Главная проблема — чтобы плоть стала свежей и молодой. Помоги! У меня есть свежий труп, на нем испробую!
