id;title;description_RU;description_EN;;
Intro;Новоселье;По окрестностям ползет слушок, что в старом домике на краю леса поселилась ведьма. Люди гадают, задержится ли она здесь надолго или ее постигнет судьба предшественниц?;Rumors say a witch moved into the old hut on the edge of the forest. People are wondering how long she is going to stay – and if she’ll share the fate of the previous ones.;;
Laughter3;;Вся округа сотрясается от смеха, кажется, жить все веселее… Или же безумие расползается по окрестностям и люди смеются даже сквозь слезы?;The village is alive with laughter and life has never looked better – or maybe everyone has finally snapped.;;
Wrong2;;Крестьяне презрительно отзываются о ваших способностях. Говорят, вы не можете правильно сварить ни одного зелья. Что ж, если есть цель избавиться от чужого внимания, то продавать бесполезное варево весьма разумно.;The peasants are dismissing you as a fraud: 'It's all mixed up all right. In her head, ha-ha!' Maybe this is a good thing – if you want to keep a low profile, that is.;;
Love3;;Любовь не всегда бывает взаимной. Уже несколько счастливых браков разрушилось – и поговаривают, что это ваша вина.;Love is a strange thing. Seemingly happy couples fall apart – and they blame you for that. ;;
Healing5;;Ведьмы редко славятся сердобольностью. Вы – исключение. Теперь даже из далеких городов приезжают люди, чтобы вы исцелили их.;Witches are seldom known for their kindness, but you've broken the mold. City folk now start coming to your neck of the woods seeking cures for their maladies.;;
Wrong1;;Люди фыркают и поджимают губы, когда слышат ваше имя – зелья им не помогают. Кто-то даже грозился отнести одно из них на проверку к дворцовому лекарю. ;People are snorting and making faces when they hear your name – your potions aren’t helping them one bit. Someone has suggested taking one to the castle healer for testing.;;
Poison3;;Странных смертей в здешних краях стало слишком много, и люди начали волноваться. Страх – не самый надежный, но все же союзник ведьмы. Нужно лишь научиться использовать его разумно…;People are unsettled by all the strange and sudden deaths that have been happened lately. Fear is an uncertain ally – but an ally still. You just need to learn how to use it right...;;
Placebo3;;По округе ходят слухи, что вы просто травница, которая прикидывается ведьмой.;Word is getting around that your remedies aren't really magical and that you're just an herbalist passing herself off as a real witch.;;
Memory3;;Люди жалуются на проблемы с памятью. Говорят, один пастух даже забыл дома свою голову! Но стоит ли верить подобным сплетням?;People are getting strangely forgetful. They say one lad forgot his head going home today because it wasn't nailed down – can you believe that?;;
Poison5;;Смертей становится больше. Вместе с ними – страха и недовольства. Кажется, местные земледельцы уже пытаются найти и наказать виновного…;Deaths are rising steeply, followed by fear and anger. The locals are starting to look for a culprit – but a scapegoat will do too!; Fear and anger follow. The locals are starting to look for a culprit – but a scapegoat will do too!;
Healing3;;Деревенские благодарны вам за лечение и разносят вести о вас до самых дальних ферм и деревень. Видимо, добрые дела – весьма неплохая реклама.;Peasants are grateful for your cures and spread rumors about you even to the furthest villages. Good deeds are a good advertisement!;;
Voice3;;В деревне появилась труппа бродячих артистов во главе с коровой. Она поет детские песни и даже пытается декламировать высоким слогом!;The village now has its very own minstrel band, lead by a singing cow. They call themselves “The Moosique Spiral” (thinking of changing the name).;;
Curse3;;С людьми и животными происходит все больше несчастных случаев. Люди шепчутся, что виноваты в том вы и ваш кот.;Misfortune befalls both people and livestock. Some whisper that it's the doing of a certain witch and her damn cat.;;
Chameleon4;;В округе все чаще загадочным образом пропадают вещи. И люди. И животные. И деньги из казны. Может, цена на зелья внимания теперь поднимется?;Things go missing way too often in the village and are nowhere to be found. People. Animals. And money from the king's treasury! Seems like the demand for perception potions should be on the rise; you better stock up.;
Laughter5;;В соседней деревне похороны. Уважаемый всеми староста умер от смеха.;There was a funeral today. A respectable townsman died from laughter.;;
Beauty3;;Красота местных селянок (и коров) гремит на весь свет. Для баланса (и вашего кошелька) было бы неплохо, чтобы и селяне-мужчины захаживали к вам почаще.;Local wenches (and more than one cow) rival princesses in their beauty. Would be nice if the men used these potions too – or at least bathed more often. Magic can only do so much.;;
Strength3;;В кабаке случилась драка, и один мужик нечаянно переломал другому ребра. Их бы силу да в мирное русло…;A tavern brawl yesterday came to a gruesome end when one man punched another so hard he broke every rib.;;
Sleep3;;Торговец мукой заснул на облучке телеги и проснулся в другом городе. Погода виновата – так говорят, зевая, старики.;The flour merchant fell asleep on his cart and woke up in the next town over. Old men blame the weather.;;
Placebo5;;Народ считает, что вы просто наливаете подкрашенную воду в бутылки, и платить вам совершенно не обязательно.;People think you're just bottling colored water and that you do not deserve their hard-earned money.;;
random-1;A present;Кто-то оставил сверток у порога вашего дома. К нему прилагалась записка: «Всего хорошего и спасибо за помощь!» Привет из прошлого?;Someone's left a present at your door. The note says 'Your help was most satisfactory'. It seems the past is catching up with you.;;
random-tax_collector;;Минувший урожай был обильным, а цены на зерно и мясо держались высоко как никогда. И вот, если верить слухам, королевский сборщик налогов уже спешит на помощь местным жителям. А то, чего доброго, захворают от алчности!;The harvest was bountiful, with grain and meat prices rising higher than ever. And now the rumor goes that the royal tax collector is already in a hurry to visit the local peasants before they waste their riches on frivolities – like new clothes or metal tools.;;
random-2;Stormy weather;Ветер рвет тяжелые тучи. Сверкает молния, но грома не слышно. Прекрасная ночь для кошмарных снов.;Heavy wind rips the leaden clouds apart. Flashes of lightning shatter the sky yet the thunder never comes. Nights like this bring nightmares.;;
random-3;Drunken prophet;То тут, то там в разговорах местных жителей всплывает ваше имя. Кому-то вы помогли, и это не осталось незамеченным. Впрочем, еще рано почивать на лаврах. Да и стоит ли вообще радоваться такой известности?;Here and there your name comes up in the conversations of local people. You have helped some, and it has not gone unnoticed. Don't get too comfortable with your newfound fame though – it's not always a good thing.;;
Painter_1_Laughter;;Судя по всему, Гоффридус решил сменить стиль – раньше его работы восхищали и удивляли, а сейчас лишь смешат, как ни пытается растерянный мастер объяснить, что это «серьезное, высокое искусство»! Но даже такая слава – это слава.;The esteemed artist Goddfridus changed his style quite radically, or so it seems. His works, which used to amaze and awe, now make people laugh – despite artist's efforts to convince them it's 'serious, high art'. Well, fame is still fame.;;
Painter_1_Beauty;;Местным художникам приходится нелегко – новые картины Гоффридуса настолько притягивают взгляд, что на другие произведения никто не хочет смотреть. Слава его растет, как и зависть коллег.;Local artists have fallen on hard times – Goddfridus's new paintings are so enthralling that no one spares a glance for other works. His prestige grows – and so does the jealousy of his peers.;;
Painter_1_Numb;;Из мастерской Гоффридуса весь день доносилась ругань – новые краски художника слишком быстро застывают, и он не успевает ничего нарисовать. Говорят, что иногда даже кисточку не удается достать из них!;People on the street could hear Goddfridus cursing and screaming in his workshop the whole day. Apparently his new paints dry too fast for him to do any work – sometimes with his expensive brushes still inside.;;
Painter_1_Unlove;;Нечто странное появилось в новых картинах Гоффридуса. Люди не могут объяснить конкретно, но все согласны, что видят в работах что-то мерзкое и противное. С каждым днем все больше людей убеждается, что его талант иссяк.;Goddfridus's new paintings are weird and unsettling. No one can say exactly why but everyone agrees they look creepy and repulsive. Every day more and more of his fans become convinced he's washed up.;;
BlacksmithDied;;В деревне помер единственный кузнец, на котором держалась большая семья. Жители очень грустят о его смерти. Найти замену мастеру будет непросто.;The village's only blacksmith is dead. As the sole provider for a large family, he will be missed greatly. Finding a new one's gonna be tough.;;
BlacksmithKilledAMan;;В пылу спора местный кузнец не рассчитал силы и прибил крестьянина. Если душегуба отправят в тюрьму, туго придется всей деревне – он был единственным мастером на всю округу.;During an argument the local blacksmith killed a man with a single blow. If the lord finds him, it's not just his family that will fall on hard times, but the whole village – he's the only smith around.;;
BlacksmithForgot;;В деревне переполох – кузнец забыл, с какой стороны браться за молот. Неясно, вернется ли к нему память. Все это время деревне будет туго.;Another disaster: the village blacksmith forgot how to hold a hammer. Tough times ahead, at least until his memory returns.;;
BlacksmithClumsy;;Над местным кузнецом потешается вся деревня. За последний день он успел: уронить молот себе на голову, подпалить волосы, когда разжигал горн, и убить подковой коня местного барона.;The local blacksmith has become the laughing stock for the whole village. Just yesterday he dropped a hammer on his head, set his hair on fire, and killed a nobleman's steed with a horseshoe.;;
BlacksmithNumb;;Близлежащая таверна решила сменить название. В ней появилась новая достопримечательность – огромная каменная статуя местного кузнеца. В открытую никто не говорит, какой «мастер» так постарался, но поглядывать на вас стали со страхом и злостью.;A local tavern is now called Smithstonian – renamed after the new tourist attraction – a life-sized statue of the village blacksmith. No one talks openly of the 'sculptor', but the looks that people give you betray their fear and resentment.;;
common_gay_event;;У пруда в звездную ночь видели двух здоровых мужиков, которые отчаянно целовались. О времена, о нравы!;The village pond. A starry sky, mirrored in still waters. Two men on the shore, kissing each other with desperate passion. O tempora! O mores!;;
moonshine-stealing-fairies-illness;;Главный поставщик браги в местный трактир слег с болезнью. По слухам, отравился собственным продуктом. Крестьяне слегка приуныли.;The beer supplier for the local tavern has fallen ill, poisoned by his own stock, or so they say. Folks have been understandably low in spirits.;;
HorseRaceReward;;Под утро пришел вдрызг пьяный хозяин лошади, победившей на скачках, и слезливо выражал вам благодарность за помощь. Про обещанный рецепт он вспомнил не сразу. Записано с его слов: «В отвар листьев крапивы вмешать толченую поганку и что-то там еще, хоть убей, не помню, мать моя, как голова болит».;The owner of the winning horse stumbled into your hut early in the morning, overflowing with drink and gratitude. You could barely shake the promised recipe out of him. As told in his own words: 'Add mashed deathcap to nettle decoction, then oh god my head is killing me I'm gonna p'.;;
AngryCitizen;;Сегодня в трактире один селянин ругал вас отборной бранью за то, что вы подвели его. Грозился повесить вашего кота.;Someone made a scene in the tavern today, swearing and cursing 'That damn witch, she screwed me, and not in a good way'. They threatened to hang your cat, too!;;
ManDiedFromPoison;;В самом расцвете сил скончался один из местных мужиков. Его вдова (и почему-то ее соседка) очень сильно горюют.;A villager in his prime dropped dead. His wife (and, oddly enough, her neighbor) is inconsolable.;;
LoveStoryVillagerCurse;;Кошмар! Самый красивый из крестьян (за которым и после замужества активно бегали девки) превратился в страшнющего урода. Единственная, кто не отвернулся от бедняги – бутылка, от которой теперь его не оторвать.;Another local tragedy. A handsome man turned into a disfigured freak overnight. His wife left him and no girl would spare a glance for the poor guy. His only solace now lies at the bottom of the bottle.;;
LoveStoryVillagerFlying;;Один из местных мужиков не вернулся с покоса. Его друзья клянутся Богом, что он улетел вместе с косой и ругательствами. Семья (и втайне его соседка) ужасно горюют!;A local man didn't come back from hay-making. His friends swear he flew away clutching his scythe and cursing. His family (and the girl next door, albeit in secret) are beside themselves with grief.;;
LoveStoryVillagerRejuvenation;;Ну и ну! От крестьянки сбежал муж. Куда – никто не знает, только соседи говорят, что вместо себя к ней в кровать младенца подсунул!;Hell's Bells! A man left his wife all of a sudden. No one seems to know where he went and why in the world he left a baby in his bed, or for that matter, where the baby came from in the first place.;;
LoveStoryVillagerLaughter;;Ночью вся деревня сотрясалась от ругани – крестьянка выгнала из дома своего мужика. И даже после этого он не перестал глупо хихикать. Бедняге пришлось бы плохо, если бы одна из соседок (как-то очень быстро) не забрала его к себе.;A woman kicked her husband from the house. Everyone in the village heard her shouts and his laughter. Why, he even kept laughing afterwards. Good thing a girl next door picked him up before long – some say she seemed too eager even.;;
bard.love;;Кажется, местная таверна «Последний заход» открыла весьма амбициозного начинающего музыканта! Густаф – запомните имя этого талантливого поэта и великолепного исполнителя, ибо оно прославится в веках!;A new ambitious musician revealed himself last night to the patrons of The Last Call tavern. Remember the name – Gustav, for this talented poet and amazing performer will surely go down in history!;;
bard.curse;;И восхищались посетители таверны «Последний заход» откровенно плохим исполнением барда, и потеряли всякий музыкальный вкус, и не желали более слышать других вагантов.;And so it came to pass that everyone present in The Last Call tavern that fateful night somehow couldn't stop listening to a frankly atrocious bardic performance, completely losing any taste for music as a result, and wouldn't hear any minstrel anymore.;;
bard.beauty;;Первый в истории этих земель конкурс красоты и очарования состоялся сегодня вечером в таверне «Последний заход». Ведущий бард Густаф уже принимает заявки на следующий конкурс!;The first ever beauty pageant our fair town has ever seen was held today in 'The Last Call' tavern. The host, famous bard Gustav, is already accepting entries for the next one!;;
bard.laughter;;Печально известный бард Густаф, которому так и не удалось снискать славу певца, сменил амплуа! Да-да, встречайте дерзкий, находчивый и смелый паяц Густаф – сегодня и каждый вечер в таверне «Последний заход». Не приходи, если боишься быть осмеянным.;Infamous bard Gustav chose a different role after failing to make it as a singer. You heard it right, folks – bold, clever and outright shameless Gustav – tonight and every night, ready to slice and dice you with his wit in 'The Last Call' tavern. Come if you dare!;;
bard.poison;;37 посетителей таверны «Последний заход» получили тяжелое отравление. Многие из них, вероятно, уже не встанут с постели. Почтенная таверна еще долго не оправится от такого удара. Подозрение пало на единственного здорового посетителя – бродячего барда, имя которого неизвестно.;Thirty-seven patrons of 'The Last Call' tavern came down with a severe food poisoning. Expectations are grim for many of them. The reputation of the famed tavern took a heavy hit. Suspicions arose around the sole customer who came unscathed – a wandering bard at large whose name is still unknown.;;
bard.flight;;Не дождавшись окончания песни артиста, горожане разлетелись по домам, в прямом смысле этого слова. Видать, нечисть какая-то завелась в наших краях. И творит эта нечисть весьма темные делишки.;The bard's song were still playing when the tavern patrons took off flying to their homes. Something's rotten in our fair village. Or some one.;;
bard.healing;;Сегодня ночью в таверне «Последний заход» завязалась большая потасовка, впрочем, как оно часто и бывает. Был убит игравший в таверне неизвестный бродячий артист. Ваше зелье спасло 37 жизней и жизнь трактирщика, но только до следующей ночи, а там – кто знает.;There was a brawl in 'The Last Call' tavern last night, as is tradition. A wandering bard, name unknown, was killed. Your potion saved 37 people and the innkeeper's life. At least until the next night.;;
bard.unlove;;Какой-то мелкий артист, имя которого никто никогда не узнает, распугал посетителей таверны «Последний заход». Видимо, его лютня была настолько расстроена, что у завсегдатаев таверны свело зубы, и мужики решили выбить парочку-другую у музыканта.;A conflict arose in 'The Last Call' tavern when some bard's badly tuned lute caused enough tooth pain to the customers who decided to knock out some of the musician's own teeth in revenge.;;
mushroom-story-event.2;Сытый покойник;Хозяин постоялого двора поведал об удивительном случае – довелось ему покойника потчевать! И так пришлась мертвецу по вкусу похлебка, что глубже в землю зарылся, утащил с собой мухоморы и поганки. Хозяин яро рекомендует местную ведьму.;The innkeeper tells a curious tale to anyone's willing to listen. Something about a feast for a dead man. The stiff was so pleased with his stew he burrowed deeper into the earth, dragging every deathcap and fly agaric with him. The innkeeper praises the local witch to high heavens.;;
Bird_Keeper_1_Poison_Curse;;Проповедники начали говорит о конце света. С неба на город падают мертвые птицы. Многие видят в этом дурной знак, свидетельство поветрия или чего хуже. И лишь бедняки возносят хвалу Господу за бесплатную еду.;Street preachers warn the end of the world is nigh. Birds drop dead from the sky. Some fear it's a bad omen or a sign of a coming plague. The beggars are simply thankful for the free food.;;
