id;title;description_RU;description_EN;;
jack-feast-food;Железный желудок;Капеллан оказался закаленным не только в боях и выпивке, но и среди едоков человеком не последним. А вот беса одолела от ваших разносолов медвежья болезнь. Тужился, краснел подлец, а потом и вовсе лопнул! С какой стороны лопнул – о том слухи умалчивают, но оно и к лучшему.;The battle-hardened chaplain put up no less of a fight when it came to drinking and stuffing his belly. Your delicacies proved too much for the demon though – he was turning an ever deeper shade of red and finally burst. What end gave first, we may never now, and maybe for the best.;;
jack-feast-success;В тыкву;Напоив беса, капеллан предложил ему на спор обернуться тыквой. Тот, окосев, решительно принял вызов. И пока нечистый пребывал в овощном виде, божий человек облил его вашим зельем. Забыл бес, как обратно расколдоваться, и застыл навек тыквой. А капеллан сделал из нее фонарь, с которым теперь ходит каждый вечер, освящая могилки и рассказывая, как врага людского трижды одурачил.;When the demon had drank enough, the chaplain dared him to turn into a pumpkin. The imp stood up to the challenge. And while he was impersonating a vegetable, the clergyman poured your potion all over him. The demon forgot how to turn back so now he's a pumpkin forever. The chaplain carved it into a lantern, which he now carries while on duty and shows as proof when he tells this story;;
jack-day1;День первый;Народ сторонится погостов в эту осеннюю пору. Мало какие места притягивают столько же нечисти и беспокойных духов. Благо что за спокойствие там отвечают отважные смотрители, и священным огнем очищают землю!;People steer away from graveyards at this time of year, those places attracting demons and restless spirits. Thank heavens the noble overseers keep their ward and cleanse the ground with holy fire!;;
jack-day2;День второй;Погосты в этом году тихи и спокойны как никогда раньше! Лишь вороны там каркают, да в ночи печально воет погребальные песни ветер.;The graveyard this year is unusually silent and calm, only the crows croak in the night and the wind somberly laments.;;
blind-inquisitor;Вершитель судеб;Вы чувствуете опасность в ночи. Ее принес сегодняшний посетитель в красном. Селяне это тоже ощущают, они говорят тише и пьют меньше. Даже животные стараются не шуметь.;You sense danger in the night. Your today's visitor in red proves to be the source. Villagers are talking quietly and drinking less. Even the animals try to step lightly.;;
circle-quest;Письмо Круга;Уважаемый колдун! Или правильнее будет сказать «ведьма»?<br><br>Моими устами вещает общество, которое мы называем Тайным Кругом. У Круга много глаз, но нам нужно еще больше. Предложите сваренную по нашему рецепту комбучу стольким посетителям, скольким посчитаете возможным. Или же тому, кто вершит судьбы. Таким образом вы докажете свою преданность Кругу.;Dear practitioner! Or shall I call you 'the witch'?<br><br>I represent the occult organization called The Circle. The Circle has many eyes, but we need more. Give our special kombucha drink to as many visitors as you dare. Or give it to the one that resolves fates. This will prove that you're worthy.;;
circle-admittance;Письмо Круга;Уважаемая ведьма!<br><br>Вы доказали, что можете быть полезны Тайному Кругу, и мы хотим сообщить, что готовы предоставить вам членство. Взнос обойдется в 150 золотых и скромное подношение. Как член организации вы сможете пользоваться особыми услугами, которые помогут вам дольше оставаться на плаву. Полагаю, вы найдете их весьма полезными.;Dear practitioner!<br><br>You have proved yourself useful to The Circle and we want to inform you that we are ready to grant you membership. The admittance fee is 150 gold and one small favor. As a member of The Circle you would be able to use our unique services to prolong your practice. I hope you will find those most useful.;;
circle-reminder;Письмо Круга;Уважаемая ведьма!<br><br>Вы доказали, что можете быть полезны Тайному Кругу, и мы напоминаем, что готовы предоставить вам членство. Взнос обойдется в 150 золотых и скромное подношение. Как член организации вы сможете пользоваться особыми услугами, которые помогут вам дольше оставаться на плаву. Полагаю, вы найдете их весьма полезными.;Dear practitioner!<br><br>You have proved yourself useful to The Circle and we want to remind you that we are ready to grant you membership. The admittance fee is 150 gold and one small favor. As a member of The Circle you would be able to use our unique services to prolong your practice. I hope you will find those most useful.;;
CircleEndingEvent;Инициация;Вы собрали достаточно денег для вступительного взноса в фонд Тайного Круга. Загадочный слепец как-то узнал об этом и пришел за вами ночью. Вместе вы отправились на церемонию инициации, гадая, что вам предстоит…;You've collected enough money for the strange organization called The Circle. Somehow the blind man got to know about that and came for you at night. You went off with him for the admittance ceremony, wondering the changes it would bring in your life...;;
witch-dream-0;Сон;Тебе снова снится тот же сон.<br>Ты стираешь белое платье матери. На ткани осталось алое пятно от пореза на твоем пальце. Но сколько ни стараешься, пятно только растет. И ты видишь, что сама вода уже багровая. Платье никогда не будет снова белым. Вокруг кровь, она разлита по полу, ботинки утопают в ней.<br>Ты просыпаешься.;This dream again.<br>You're trying to wash out the stain on your mother's white dress. You've cut your finger and there is a red spot. Yet the more you try, the bigger the stain gets. Then you see that the water is red with blood. You will never be able to make the dress white again. Blood is all around you, on the floor, up to your ankles.<br>You wake up.;;
witch-dream-1;Сон;Снова сны, но теперь иные.<br>В белоснежном платье ты бежишь по вересковому полю, улыбаясь летнему солнцу. Под большим деревом тебя ждет он. Ты видишь его улыбку и твое сердце наполняется радостью. У него букет полевых цветов. На каждую вашу встречу он приносит разные цветы.<br>После таких снов не хочется просыпаться, никогда.;The dreams are there, but this time they are different.<br>You're running in a spotless white dress through the heather, sun shining on your face. He is waiting for you there, under the big tree. You see him smiling, and your heart gets wild with joy. He has a bunch of wild flowers. Each time you meet the flowers are different. <br>These are the dreams you don't want to wake up from.;;
witch-dream-2;Сон;Снова сон. Ты снова бежишь к нему.<br>Но в этот раз вместо радости чувствуешь лишь боль. Сверкает молния, раскалывая землю. Ты кричишь его имя. Гром звучит как истерический смех, заглушая твой крик. По земле бежит трещина, и вы с ним по разные ее стороны. Мир утопает во тьме.<br>Ты просыпаешься с чувством одиночества.;The dream is back. You're running to meet him again.<br>But this time instead of joy you feel the crushing pain of reality. The lightning comes, shattering the ground apart. You scream his name. The thunder follows as a hideous laughter, drowning your cry. A crack forms on the ground, splitting you from him. Darkness hides you both.<br>You wake up alone.;;
witch-dream-3;Сон;Сон.<br>Ты снова на расколотом вересковом поле. Но теперь тебе дают выбор: отказаться от души и перебраться на ту сторону, и это навсегда изуродует тебя. Выбор сложный, но он сделан. Нечеловеческим прыжком ты перелетаешь через расщелину и когтями вцепляешься в любимого. Никогда больше он не покинет тебя! Но в твоих лапах он рассыпается струями праха… И такими же струями кровь льется на белый лист бумаги, ставя печать на твоей судьбе.;The dream is there.<br>You are in the heather field and the earth shatters apart. You've been given a choice to abandon your own soul and become a monster, and you accepted without any doubt. As a white tiger you leap across the crack. With your claws you clench your love, never letting go of him. Never losing him again. Then you watch him turn into dust right in your paws. Dust falls on the shaking ground like blood flowing on a white sheet of paper, in stripes, sealing your fate.;;
random-rogues-2;;Местные землевладельцы, измученные постоянными набегами разбойников, объявили о награде за голову каждого мерзавца, позарившегося на чужое добро. Удивительно, что граф, присматривающий за обширными полями, отказался поддерживать начинание и заявил, что голова без тела не стоит и ломаного медяка.<br><br>Голов много, да не все они разбойничьими будут, сказал он.;Local landowners, driven to desperation by the raiding brigands, set a bounty on the head of any low-life scum coveting his neighbor's wealth. To everyone's surprise, the Count refused to lend his support, saying that a head is worthless with no body to bear it.<br><br>The heads will roll, he said, but probably not just the sinners'.;;
seeds-letter;;Мельница крутит жернова без устали, и часто в них попадают простые смертные. У одного крестьянина не хватило денег, чтобы рассчитаться за помол, и мельник побил его. Той же ночью разбойники разгромили мельницу, и теперь на какое-то время вся округа останется без муки.;The wheels of fate turn like grindstones and what goes around comes around. A peasant refused to pay a miller's share, deeming it too high. The miller beat him up. The night after brigands ransacked the mill and for the time being the flour stopped flowing. So it goes.;;
seeds-reminder;;Ночью вам принесли записку и колосок.<br><i>Ты меня уж и не вспомнишь. Но погляди на эти колосья! Да нигде в мире таких колосьев не видали! С какой радостью я бросил бы их в королевское рыло… Этот позолоченный истукан долгие годы пытается от меня избавиться. Считает, что я слишком мягок с разбойниками и местными жителями, что им потакают. С твоей помощью мы сможем спасти народ от его гнета. Но сперва у меня к тебе будет дельце. Я зайду завтра. Граф О.</i>;A messenger in the night brought you an ear of wheat and a note.<br><i>You probably won't remember me, but would you look at this grain! The quality is unparalleled! Oh how I wish to throw them into the king's snout!.. He's been trying to get rid of me for years. Thinks I'm too soft with the bandits and the locals who sympathize them. With your help we'll be able to free the people from his oppression. But first I need to tend to another business. I'll see you tomorrow. Count O.</i>;;
seeds-letter2;;Посыльный графа приносит записку.<br><i>Знатно проучили мы барона! Только, видать, прознал он, что моих то рук дело. Пустил в мой амбар мышей, и те попортили зерно! Не могу я такое спустить ему. Утром к тебе заглянет один из моих друзей. Не смотри, что одет он как оборванец – это достойнейший человек во всем королевстве! Помни об этом, когда придет время выбирать сторону.</i>;Another note from the Count.<br><i>We taught the Baron a good lesson! Yet somehow he learned it was my doing. He retaliated by sending men to set my granary on fire. (I just know it was him, the knave!) I can't let him get away with it. In the morning, one of my friends will drop by. Never mind his raggedy posterior – he's the most honorable man in the realm. Remember this when the time comes to pick a side.</i>;;
seeds-letter2-poison;;Посыльный графа приносит записку.<br><i>Переборщила ты с винцом, помер старик дегустатор у моего соседа. Сразу прознал он, что то моих рук дело. Пустил в мой амбар мышей, и те попортили зерно. Не могу я такое спустить ему. Утром к тебе заглянет один из моих друзей. Не смотри, что одет он как оборванец – это достойнейший человек во всем королевстве! Помни об этом, когда придет время выбирать сторону.</i>;Another note from the Count.<br><i>The wine proved too strong for Baron's tastes – his cup bearer died a gruesome death. He must've learned it was my doing and retaliated by sending men to set my granary on fire. I can't let him get away with it. In the morning, one of my friends will drop by. Never mind his raggedy posterior – he's the most honorable man in the realm. Remember this when the time comes to pick a side.</i>;;
seeds-baron;;Барон доложил королю, что сосед подослал к нему шайку бандитов. По счастливой случайности налетчики вели себя странно, путались в собственных ногах, не могли удержать оружия и быстро сдались страже. Барон выпытал, кто их подослал, и узнал, что граф пользовался чарами, чтобы вырастить дьявольский хлеб! Злодея передали в руки церкви, а его земли король перепоручил досточтимому барону. Увы, главаря разбойников поймать не удалось.;The Baron reported to the king that his neighbor tried to sic a band of thugs on him. Luckily, the raiders, who were tripping over their feet and couldn't hold their weapons, quickly submitted to the guardsmen. It took some convincing at the hands of the torturer but they cracked eventually. According to them, the Count used dark magic to grow devil's bread! The maleficar was turned over to the Church and his lands went to the esteemed Baron. Alas, bandit leader is still on the loose.;;
seeds-count;;Влиятельный граф заявил, что готов поделиться уцелевшим заморским зерном со всеми желающими. И после этого голод больше не ступит в наши славные края! Увы, за добрыми вестями все быстро позабыли о печальной судьбе барона, чье поместье разгромили разбойники. Они были сыты, хорошо вооружены и экипированы. Барона, как говорят, насильно кормили мукой, пока он не умер в жутких корчах. А что сделали с его семьей – лучше не знать…;The count declared that he is ready to share all his remaining grain and flour with every man in need. The good news made everyone forget the sad fate of his neighbor whose manor was ransacked by the bandits. Well-fed and well-armed men stormed the place and enacted their twisted judgment Rumor is, they fed the baron raw flour until he burst. And what befell his family is best left unsaid.;;
seeds-default;;Странные вещи творятся в королевстве. Влиятельный граф не оправдал надежд короля, который поручил ему важнейшее государственное дело. Из-за этого граф лишился титулов, владений, и, если верить слухам, тут же прибился к местной разбойничьей артели. Окрестные земли наполнились слухами и догадками, что могло связывать родовитого владетеля с шайкой отребья?;Something is rotten in our fair realm. The count, a man of power and influence, fell into disgrace after mishandling a state affair of utmost importance entrusted to him by the king himself. He was stripped of all titles and lands, the latter going to his neighbor. Rumors suggest he went as far as joining a bandit gang afterwards. What could possibly tie an aristocrat to a band of common rabble?;;
seeds-fail;;Крестьяне рассказали вам о том, что некий граф погубил плодородную землю темными чарами. За провинность лишился всех титулов, а его владения передали соседу. Самого падшего дворянина отправили на казнь в столицу, но по дороге его выкрали разбойники и уволокли в лес. Вот и поделом мерзавцу!;The peasants told you about a noble who ruined the fertile lands with dark magic. The count was stripped of titles and his lands went to his neighbor. The noble was bound for execution but he was kidnapped by the bandits on his way to the capital. Serves him right!;;
BanditFractionEvent;;Егеря говорят о том, что видели, как в лесной чаще пылают по ночам разбойничьи костры. Их так много, что даже смотреть жутко. По городам и деревням шныряют самого лихого вида людишки. Скупают еду и лошадей, произносят опасные речи о том, что скоро страдания простого народа закончатся и зажравшиеся властолюбцы будут свергнуты.;The huntsmen speak of bandits' fires lighting up the forests at night, eerie and unnerving. Shady people are scurrying around towns and villages. They buy up food and horses and make bold speeches about ending the suffering of common folk and overthrowing the greedy despots.;;
bandit-final-fail;;Светлый наш правитель подло ранен на охоте! Но перед силой и чистотой его духа отступила даже смерть! Король обвинил епископа в том, что тот возжелал усадить на трон самозванца и нанял головорезов для покушения. После чего отправил на поиски разбойников сотни солдат, велев жестоко допрашивать местных жителей и карать тех, кто помогает налетчикам. Головорезов переловили, и они признались, что получали деньги от церкви!;Our illustrious monarch was grievously wounded during a royal hunt when a treacherous blade struck from the ambush. But his pure and valiant spirit overcame death itself! The king accused the archbishop of conspiring with a would-be usurper and organizing the assault. He then sent hundreds of guardsmen to comb the countryside. The thugs were caught and under torture they confessed they were taking money from the bishop.;;
bandit-connections;;Вас заочно обвинили в помощи разбойникам и участии в мятеже. Слухи о вашем ремесле быстро достигнут ушей инквизиции, так что готовьтесь к худшему. Впрочем, кто-то ночью пришпилил кинжалом к вашей двери большой кошель, набитый золотом. Кинжал кажется смутно знакомым. Может, эти деньги вам помогут?;You were accused of aiding bandits and participating in rebellion. Rumors of your craft will soon reach the ears of the inquisition, so prepare for the worst. At least someone pinned a gold purse to your door with a familiar-looking dagger last night. Money won't hurt – you surely need all the help you can get.;;
bandit-final;;Узурпатор пришел к власти не без вашей помощи. Помните ли вы об этом, глядя на сожженные поля, залитую кровью землю и исклеванные воронами тела, раскачивающиеся на виселицах? Так или иначе, теперь у вас есть друзья при дворе, что сделает жизнь проще и безопаснее… на какое-то время.;The usurper sits on the throne, thanks in part to you. Will you remember this when you look at the burned fields, blood-soaked earth and rows of gallows with bodies hanging from them? Anyway, now you've got friends in high places, which should make life easier and more safe... at least for some time.;;
