id;title;description_RU;description_EN;;
M-river-rogues-flight;;В таверне «Последний заход» дозорный с речной заставы рассказывал, что ночью над укреплением пролетал отряд вопящих разбойников. Приземлились они в районе жутких топей, так что одной бедой в наших землях стало меньше.;At the Last Call tavern, a lookout from the river outpost said he saw a party of screaming robbers fly over the fortification. They landed in some terrible swamps, thus eliminating one of the threats to the king's lands.;;
FameUp;Слухи;Нищенка на рынке клялась, что до сего утра была глухой, слепой, немой и горбатой. Но после того, как здешняя ведьма угостила ее особым эликсиром, все недуги как рукой сняло. Видимо, говорить ее научил тоже эликсир, либо ведьмин кот.;A beggar woman was telling everyone on the market square that she used to be a deaf, blind, mute hunchback up until that morning. But all her ailments went away after a local witch gave her a very special elixir. Right, and the witch's cat taught her to talk.;;
FameUp2;Слухи;Во время стирки одна из хозяек поделилась с соседками удивительной смесью щелока и едкого порошка, пахнущего душистыми травами. Белье после него становилось мягким и ароматным, будто новое. По секрету женщина рассказала, что порошок ей подарила живущая неподалеку приветливая ведьма.;One of the women washing clothes in the river shared a wondrous mix of lye and fragrant herbs with the others. It made linen soft like new. In secret, the woman said that the powder was given to her by a friendly witch who lived nearby.;;
FameUp3;Слухи;По местным землям пронесся слух о том, что некая ведьма вылечила всех жителей безымянного поселения от страшной болезни. После исцеления крестьяне вовсе перестали хворать, стали работать с утроенной силой, проявляли недюжинные способности в грамматике, могли с разбегу перепрыгнуть через дом… Не всем слухам следует верить, но, очевидно, та ведьма знает толк в лекарском искусстве.;A rumor spread through local lands that a certain witch had cured every inhabitant of an unnamed village of a terrible disease. Afterwards the peasants never fell ill again, exhibited unusual strength and endurance and some even learned to read and write. Not every rumor is to be believed, but maybe there is a grain of truth to it...;;
FameDown;Слухи;Недовольный старик ходил по городской площади и размахивал бутыльком, наполненным водой. Кричал о том, что местная знахарка продала ему пустышку вместо зелья долголетия, и убеждал местных жителей не ходить к мошеннице.;A disgruntled old man brandished a bottle filled with water in the town square. He shouted that the local healer was a fraud because she sold him a fake “potion of youth.” Some people listened and nodded sympathetically.;;
FameDown2;Слухи;В народе ходит слух о том, что из-за скудного урожая ячменя и пшеницы теперь почти не найти злакового корня. Поэтому все травницы, ведьмы и чародеи в округе на какое-то время перестали варить столь популярные целебные и укрепляющие зелья. А если и варят, то ломят такую цену, что проще подорожником лечиться.;There is a rumor among the populace that due to the poor barley and wheat harvest it is now nigh impossible to find any wild roots. Now no herbalist, witch, or hedge wizard can brew the ever popular healing and strengthening potions. And even when they do, the price is such that it's cheaper to pray the pain away.;;
FameDown3;Слухи;Ваш кот выболтал самым языкатым сплетницам округи то, что вы настоящая мошенница. Котел у вас ненастоящий, зелья работают плохо, а цены такие, что и вслух сказать стыдно! Кот подумывает уйти к другому колдуну, настоящему и щедрому.;Even your cat let it slip that you're a first-class fraud. Your potions barely work, your prices are exorbitant and you stir your cauldron widdershins. He is thinking of leaving you for another sorceress.;;
FearUp;Слухи;Темные чары опутали наши земли! Люди твердят о том, что видели следы огромных копыт на влажной от туманов земле. Но одна девочка уверяла, что оставил их гнуснейшего вида кот в подкованных сапогах. Что за неразумное дитя!;Dark magic poisons our lands! People tell tales of giant hoofprints leading into the mist. A little girl swore that they were left by a nasty-looking cat in iron-shod boots. What a silly child!;;
FearUp2;Слухи;Местные дети рассказывают о том, что тайком пробрались к заброшенной лесной хижине и увидели, как бледная дева в погребальном саване играет на арфе, сделанной из человеческих костей и сухожилий. А тени, зачарованные жуткой музыкой, плясали вокруг ветхого дома, подвывая и показывая срамные жесты.;Local children say they sneaked into the forest at night and there, near an abandoned hut, saw a maiden pale in a funeral shroud, playing a harp made of human bones and sinew. Shadows rose, ensorcelled with the eerie music, and danced around, making the most obscene gestures.;;
FearUp3;Слухи;Темные силы похитили святой крест с маковки одного из монастырей и опоили дурманящим вином служителей. Испортили святое писание, изменив смысл молитв и превратив их в хулительные. Епископ поручил отыскать виновников и жестоко наказать, но прихожане по-прежнему напуганы произошедшим.;The servants of the dark are growing stronger and bolder. They stole a holy cross from the top of a monastery and turned the blessed wine into an intoxicating swill that brings nightmares. They've changed holy scriptures, turning books of prayers into profane obscenities. The bishop ordered to find and punish the culprits, but the parishioners are still too frightened.;;
FearDown;Слухи;Местная ведьма предрекла по звездам снежную и безветренную зиму, а также теплую и раннюю весну. Это говорит о том, что урожай будет обильным и на ближайший год хлеборобам и ремесленникам не грозит страшный голод. Хоть какие-то хорошие новости в наши суровые времена! Впрочем, лишний мешочек с зерном в амбаре всегда лучше припасти, а то всякое бывает…;A local witch had read the stars and predicted a snowy and windless winter, followed by an early and warm spring. This promises a bountiful harvest – at last, some good news in our trying times. Never hurts to save an extra bag of grain though, anything could happen...;;
FearDown2;Слухи;В деревню лесорубов заявился статный воин, предоставивший доказательства, что он в одиночку прикончил жуткого оборотня. Героя поздравили и угостили брагой, но многие недоумевали, откуда здесь вообще взялся оборотень, почему его голова похожа на бутафорскую, да и до ближайшего полнолуния еще недели три.;A handsome warrior showed up at the lumberjack village, claiming he's killed a fearsome werewolf single-handedly. The hero was praised, and many a mug of beer was drunk in his honor, although some questioned how come there was a werewolf around during a new moon and why did its head looked a lot like that of a dog, and not very large at that.;;
FearDown3;Слухи;В наши темные дни случаются и проблески радости. По столице ходят слухи об отважном слепце, усмирившем буйствовавших в древнем склепе духов. Что за склеп и чьи духи там бесновались – молва умалчивает, но новость наполняет сердца горожан теплом и покоем.;Another glimpse of hope in these dark days. Everyone heard a tale of a brave blind man who exorcised wild spirits from an ancient crypt. No one is quite sure whose crypt it was or what kind of spirits were there – the story is always told differently, but people are glad nonetheless.;;
witch-outro;;Ваш любимый спит у огня, свернувшись калачиком. Впервые за много лет вы смотрите на него и понимаете, что все это время он был глубоко несчастен. Возможно, с судьбой кота он смирился, но ваше общество его давно уже тяготит. Ему хочется воли.;Your loved one is sleeping by the fire, curled up in a furry ball. For the first time in many years, you look at him and realize that all this time he has been deeply unhappy. Perhaps he has come to terms with the fate of the cat, but your company has long been a burden to him. All he really wants is freedom.;;
KingFractionEvent;;В городе все чаще стали появляться подозрительные личности, предлагающие хорошую плату за слухи и факты о каких-либо делах, связанных с епископом. Будь то купленная им корзина с пирожками на торговой площади, либо тайная встреча за городом. За ложь и правду платят одинаково хорошо, вопрос лишь в том, чей кошелек за этим стоит и для каких целей собирают сплетни.;Suspicious individuals appear more and more often in the city, offering good payment for rumors and facts about any matters related to the bishop. Be it a basket of pies he bought at the market square, or a secret meeting outside of the city walls. They pay equally well for lies and truth: the only question is whose wallet is behind it and for what purpose the gossip is collected.;363;383
MovingEnding;Переезд;Окрестные земли заметно изменились после вашего переезда, и посетители появляются все реже. Кому-то вы помогли, кому-то навредили, в одни дела ныряли с головой, а другие предпочитали пропускать мимо. В любом случае, это были славные и хлопотные деньки, но останавливаться на достигнутом не в ваших правилах…;The neighborhood changed a lot since you've moved here. The visitors don't come as often anymore. Whether you'd helped or harmed them, plunged deep into their problems or waived them off – now it's all water under the bridge. It was good while it lasted and now it's time to move on. There is no rest for the wicked, after all.;307;327
bishop-final-cured;;Слушайте же, стар и млад!<br><br>Во время пасхальной службы на правителя снизошло озарение! Он покаялся во грехах, согласился избавиться от злобных советников и поклялся более не поднимать меча на служителей господа! Королевство будет очищено от скверны и ереси, и в наших славных землях вновь воцарятся порядок и мир. Помолимся же за здоровье славного короля и светлого епископа!;Hear ye, hear ye! During the Easter service our king had an epiphany! He repented his sins, agreed to banish his corrupt counselors and swore an oath to never again raise the sword against the servants of the Lord! The realm will be cleansed of heresy and filth and peace and order will once again reign our blessed land. Let us pray for the health of our noble king and illustrious bishop!;380;390
nest-harvester-strength;Дары природы;Крестьянин, набравший огромную корзину яиц на скалах, рассказал о громадных гнездах, добраться до которых иначе как без крыльев не получится. Вокруг сновали диковинные птицы, напоминающие больших сорок. И кто знает, какое добро оно могли натаскать в гнезда за долгие годы?;A villager who had collected a huge basket of eggs on the rocks told of giant nests that looked impossible to reach without wings. Strange birds, resembling large magpies, were scurrying around. Wonder what kind of things they might have brought into their nests over the years?;272;278
nest-harvester-love;На крыльях любви;Говорят, какой-то селянин всем сердцем полюбил прекрасную скальную птицу. Пел, как умел, ей серенады, приносил червячков и даже мясо. Увы, небесная летунья вместо взаимности ответила лишь метким и весьма вонючим отказом.;They say that a villager fell in love with a beautiful rock bird. He sang serenades to her as best he could, brought her worms and even meat. Alas, instead of reciprocating, she answered only with an accurate and rather stinky refusal.;220;235
nest-harvester-perception;Ценная находка?;Говорят, голодающий селянин отыскал высоко в скалах странный предмет – древний крест, отлитый из бронзы. Артефакт всегда теплый и рядом с ним человек не испытывает ни голода, ни усталости.;Rumor has it that a starving villager found a strange object high in the rocks - an ancient bronze cross. The artifact is always warm to the touch, and a person feels neither hunger nor fatigue in its presence.;188;210
nest-harvester-forage;В серых скалах золото есть!;Радостный селянин вручил вам горсть старых монет разной чеканки. Большую часть добычи он решил потратить на рыбу и мясо, чтобы в родной деревне никто не голодал. Да еще и на налог останется, если вдруг снова заявится докучливый сборщик податей.;A joyful villager hands you a pile of old coins. He has decided to spend most of it on fish and meat, so that no one in his village would go hungry. And there will even be some left over, in case that pesky tax collector shows up again.;244;236
nest-harvester-default;И рыбы сыты, и яйца целы;Моряки с каботажного судна стали свидетелями печального события. Не шибко разумный селянин пытался забраться на скалы, но шлепнулся с изрядной высоты в воду. Вел себя он странно, так что его сочли безумцем. Тем более до этого селянин хвастался перед соседями, что какая-то ведьма поможет ему воспарить к небесам…;Sailors from a coaster ship witnessed a rather sad event. Some not very bright peasant tried to climb the rocks, but fell from a great height into the water. He behaved oddly, so he was deemed insane. Especially considering that a day before, the villager had boasted to his neighbors that a witch would help him soar into the sky...;312;333
nest-harvester-foolish;Яйца вкрутую;Селянин притащил в родную деревню корзину, набитую камнями, и уверял местных жителей, что это птичьи яйца. Несколько даже попытался сварить и почистить, но лишь расколол столешницу и сломал ногти. Не иначе, с голоду умом тронулся!;A peasant brought a basket full of stones to his home village and assured everyone that they were bird eggs. He even tried to boil and peel some, but only cracked his table and broke his nails. Verily, the hunger drove him insane!;230;230
nest-harvester-curse;В серых скалах яиц нет!;В народе ходит слух о голодающем крестьянине, что отправился собирать птичьи яйца на скалах и пропал. Теперь вряд ли среди местных отыщется смельчак, что отправится туда за добычей. И кто знает, какие тайны и сокровища хранили скалы?;They speak in hushed tones about a peasant who was driven by hunger to brave the cliff rocks for bird eggs and disappeared, never to be seen again. It is unlikely that there will be another daredevil who will go there. And who knows what secrets and treasures the cliffs held?;233;276
nest-cross-forget;Найдено и забыто;Монахиня, что верой и правдой служит народу и церкви, разыскала одну из ценнейший и старейших реликвий в этих землях – крест Святого Аскета. Его сила бесценна во время постов, так как избавляет от чувства голода всех в округе. Радостный епископ освободил простой люд от церковных податей и даже велел раздать нуждающимся муку и масло. Кажется, святость возвращается в наши мрачные земли!;A faithful nun has found one of the most valuable and ancient relics in the land, the Cross of the St. Ascetic. Its power is invaluable during Lent, as it relieves the hunger of everyone in the neighborhood. The joyous bishop exempted the commoners from tithe and even ordered flour and butter to be distributed to the needy. It seems that holiness is returning to our gloomy lands!;387;382
nest-cross-love;От чистого сердца;Довелось некоему селянину влюбиться до безумия в монахиню. Поскольку та давно отрешилась от плотских страстей и всего мирского, несчастный мужик не придумал ничего лучше, чем подарить ей старый крест. Божья дева тут же узнала в подарке ценную реликвию и передала ее епископу. Воистину, сила любви творит чудеса похлеще древних артефактов!;A certain villager fell madly in love with a nun. Since she had long ago renounced carnal passions and all worldly things, the unfortunate man thought of nothing better than to give her an old cross. The nun immediately recognized the gift as a priceless relic and handed it over to the bishop. Truly, the power of love works miracles!;338;335
nest-cross-poison;Бездуховность;Монахиня заполучила крест, но какой ценой? Мало того, что из жизни ушел нашедший реликвию селянин, так еще и сам крест вдруг превратился в безделушку. Епископ, конечно, его принял, но сразу усомнился, что именно он принадлежал святому аскету, и велел убрать подальше.;The nun got the cross she coveted, but at what cost? Not only did the villager who had found the relic pass away, but the cross itself lost its magic. The bishop, of course, accepted it, but doubted that it belonged to the ascetic saint, and ordered it to be put away.;267;268
nest-cross-foolish;Забытому – забвение;Всю округу всполошила история о селянине, что отыскал в скалах древних крест. По виду, тот походил на реликвию Святого Аскета, вот только помимо тепла и изведения голода, крест заставил мужика орать не своим голосом или хихикать как девица. Бедолагу отправили под присмотр местного монастыря, а крест расплавили от греха подальше.;The whole neighborhood was abuzz with the story of a villager who found a cross in the ancient rocks. It looked like a relic of the Holy Ascetic, except it not only relieved the man from cold and hunger, but also made speak in tongues or giggle uncontrollably. The poor man was sent to the care of the local monastery, and the cross was melted down for good.;330;358
Zolotar-poison;Колпак упал;Не зря древние мудрецы говорили, что дурному и в кружке с молоком утонуть по силам. Вот один из деревенских дурачков и умудрился помереть, копаясь в навозной куче. А задохнулся он или еще какая беда приключилась – неизвестно.;As the saying goes, a fool can drown even in a mug of milk. Well, one such fool died recently while shoveling dung. It is not known whether he suffocated or had some other misfortune.;225;183
Zolotar-beauty;Писк моды;Нынче среди знати и зажиточных горожан вошли в моду особые украшения, которые лепит народный умелец. Из чего он их делает, спросите вы? Из самого презренного материала, но, благодаря таланту, даже навоз обретает дивные формы, от которых не отвести глаз! А одна из приближенных к короне дам недавно сразила гостей на балу шикарной диадемой, в которую был инкрустирован особый… самородок.;Some very special jewelry sculpted by a folk artisan is all the rage among the nobility and wealthy townsfolk nowadays. What does he make it out of, you may ask? From the most despicable material, but, thanks to his divine talent, even dung acquires magnificent forms that just draw the eye! And one of the ladies of the court recently wowed the guests with a gorgeous tiara inlaid with an unique... nugget.;386;407
