id;title;description_RU;description_EN;;
SleepVillagerLaughter;;Местные нашли себе новое развлечение! Один мужик по ночам дает послушать, какие странные звуки издает его братец из города. То смешливо храпит, то хохотать во все горло начинает, даже с кровати скатиться может от хихиканья, а все не просыпается!;Locals' got a new favorite pastime. For lack of a better amusement they gather to watch a snoring man. His whimsical wheezes and giggling snorts are a laugh for the whole village. It's not often you see a sleeping man fall from his bed in a burst of laughter and keep sleeping.;;
mary.91;;Одна из селянок летала в полночь голой на метле и хохотала как безумная. Вряд ли она ожидала, что инквизиторы так быстро ее поймают и бросят в темницу. Пусть теперь за решеткой посмеется.;This midnight a local girl was seen flying around on her broom. Stark naked and laughing wildly. The church took immediate actions and locked her up. Who is going to laugh now?;;
mary.92;;Одна из селянок скакала в полночь голой на метле и хохотала как безумная. Наверное, съела или выпила чего-то не того.;A local girl took to running around with her broom, stark naked and laughing. Perhaps there's something in the water.;;
mary.93;;Местная девушка была найдена мертвой в собственном доме, неестественно скрюченной и с застывшим в глазах ужасом. Горькая утрата, родные и друзья убиты горем.;A local girl was found dead in her room, with terror in her eyes and all twisted up. A shocking tragedy for her friends and relatives.;;
MerchantReturned;;Благодаря вашему зелью, торговец смог улизнуть от бандитской засады, хоть и потерял часть товаров.;Thanks to your potion the merchant was able to dodge a bandits' ambush. He still lost part of his wares but saved his life.;;
MerchantReturnedVeryWealthy;;Благодаря вашему зелью, торговец всю дорогу был начеку и смог улизнуть от бандитской засады. Он хорошо отблагодарил вас.;Thanks to your potion the merchant stayed sharp the whole way and dodged a bandits' ambush. He has paid you handsomely.;;
MerchantDied;;Местный торговец так и не вернулся в деревню. Возможно, просто уехал в другой город. Но многие видели, как прямо перед пропажей он заходил к вам.;The merchant never returned to the village. Who knows, maybe he decided to move. But his visit to you right before he disappeared didn't go unnoticed and now people are talking.;;
tavern.numb;;Хоть Густаф и потерял голос, но желание играть на лютне никуда не пропало. Теперь музыку он сопровождает мычанием. Иногда даже попадает в мелодию.;Gustav lost his voice but not his passion for music. He now moos instead of singing and even hits some notes right. Sometimes.;;
tavern.memory;;Хозяин таверны благодарит вас за помощь. Бард действительно забыл дорогу в таверну в эту ночь и блуждал со своей лютней где-то на другой стороне города.;Tavern owner thanks you for help. The bard forgot his way to the tavern last night and wandered the city hugging his lute.;;
tavern.voice-change;;Хоть голос у Густафа и стал более глубоким и чарующим, игрец на лютне из него все же был никакой.;Gustav's voice got deeper and more captivating, but he still couldn't hit a single note on his lute.;;
tavern.sleep;;Хозяин таверны благодарит вас за помощь. Даже похрапывая на крыльце таверны, бард Густаф умудрялся фальшивить.;Tavern owner thanks you for help. Gustav slept on the porch the whole night, snoring out of tune.;;
tavern.wake;;Всю ночь рвался Густаф в таверну. Утром, потеряв надежду, он устроил концерт на главной площади. Горожанам понравилось развлечение, они заплатили держателю таверны, и тот, скрепя сердце, разрешил Густафу выступать под крышей.;Gustav spent all night trying to enter the tavern but the owner kicked him out every time. In the morning he gave an impromptu concert on the town square. People liked it and paid the tavern owner, and he grudgingly allowed the unfortunate bard to perform indoors.;;
old_knight_event.2;Экий славный рыцарь жил;Свершилось чудо! Старый рыцарь победил на большом турнире, покрыв себя неувядающей славой. Вместе с молодой женой поселился в одном из речных замков и поговаривает о продолжении рода! Воистину, старый конь…;A miracle! An old knight won the grand tourney and covered himself in glory. Newlyweds – why, yes, there's a young wife as well! – settled down in one of the river castles and are even thinking of having children. The older the fiddle…;;
BanditDied;;Кто-то скажет, что вы взяли грех на душу и обрекли человека на мучительную гибель. Но в окрестностях стало безопасней, никто больше не грабит землевладельцев и торговцев, так что тяжесть прегрешений уравновешивает ваша чистая совесть.;You refused to help a man in need, thus ending the bandit's tale. A heavy sin, but the robberies have stopped and the merchants and tax collectors are feeling safer now.;;
TaxCollectorAwesome;;Присланный в деревню сборщик налогов пользуется большим успехом у местных девушек. Те встают в очередь, чтобы отдать свой гражданский долг.;The tax collector is very popular among local girls. They've actually formed a queue to pay their civic duty.;;
TaxCollectorAwesome2;;Сборщик налогов не зря ест королевский хлеб. В крестьянских амбарах, избах и дворовых нужниках не осталось ни щелочки, в которую бы сборщик не запустил загребущую лапу. Говорят, сундук с мытом еле уместился в телеге… ;One ought to have guts to be the royal tax collector. In the peasant barns, huts and outhouses there was not a single crack left into which he would not put his raking paw. They say all the loot barely fit into his cart... ;;
TaxCollectorFoundDead;;Присланный в деревню сборщик налогов найден мертвым в своей комнате. Ничем хорошим для селян это не закончится.;The tax collector was found dead in his room. This doesn't bode well for the villagers.;;
TaxCollectorFunnyVoice;;В деревню прибыл сборщик налогов с таким смешным голосом, что люди приходили толпами над ним посмеяться. Кто-то даже дал ему монетку.;The tax collector arrived. His funny voice gathered crowds of fascinated onlookers. Some even threw coins at him.;;
BlacksmithKilledByMan;;Один из крестьян пристукнул кузнеца. Он говорил, что «силушку не рассчитал», но крестьяне уже скрутили его и передали на суд. Шутка ли – единственного мастера убил!;One of the peasants killed the blacksmith in a tavern brawl. He swore he didn't want to and didn't know his own strength, but the others tied him up and delivered him to the authorities.;;
DrunkDied;;В местной таверне одному завсегдатаю стало плохо. Его не успели откачать, но он слыл нехорошим человеком – грустят по нему немногие.;A drunkard died in the tavern the other evening. Halfhearted attempts to save him were futile. Considering his reputation, he won't be missed by many.;;
VillagerBlacksmithRejuvenation;;Один местный парнишка закатил истерику, когда ему не продали пиво в местной таверне. Он пытался выдать себя за одного из постояльцев, но кузнец легко выбросил его в придорожную грязь.;Some lad made a scene after he'd been refused service in the local tavern. He tried to impersonate a patron but the blacksmith threw him out.;;
VillagerBlacksmithPerception;;Ночью в одной из таверн привычно завязалась драка. Необычно в ней то, что крестьянин, раньше никогда не отличавшийся верткостью или силой, легко вышел из нее победителем. Очевидцы говорят, он просто тыкал людям в разные места пальцем, и противники валились как подкошенные.;Another night, another tavern brawl. Business as usual. Unusually, the last man standing was the one who never showed much fighting prowess before. People say he felled every opponent just by poking them once with his finger.;;
VillagerBlacksmithMemory;;Удивительное дело, один из закадычных неприятелей местного кузнеца внезапно решил забыть все обиды и помирился с ним. Людям кажется, что он позабыл куда больше, но, по крайней мере, проблем в деревне точно станет меньше.;Surprisingly, a man who held a grudge against the blacksmith for the longest time forgot his grievances and made peace with him. People feel like he forgot more than that but generally agree that there will be less trouble in the village now.;;
moonshine-stealing-fairies-bold;;Все больше крестьян стало замечать, что у них пропадают припасы. Мужик в трактире рассказал, как просил у вас помощи супротив вороватых чертей, но все стало только хуже.;More and more peasants notice that someone steals their supplies. A man told his drinking buddies that he asked for your help against the thieving pixies but things only got worse.;;
moonshine-stealing-fairies-caught;;Ночью крестьянин принес вам бочонок браги и рассказал, как удачно поймал упившихся чертей в сачок и заключил с ними договор. Он ставит им кружку браги, а они ходят пакостить в другое место. На этих словах мужик заговорщицки подмигнул.;This evening a man brought you a barrel of beer and told how he caught drunken pixies with a net and made a deal with them. For a share of beer they leave him alone and go stealing someplace else. The last words were said with a knowing wink.;;
LoveStoryVillagerLove;;Блудливый муж крестьянки вернулся домой. Совсем недавно он сбежал к соседке, а теперь стыдливо приплелся обратно и клялся Богом, что «не знает, что на него нашло, и с той страхолюдиной в одном доме находиться не может».;A prodigal husband returned home. Just a short time ago he left his wife for his neighbor and now he's back with his tail between his legs. Says he doesn't know what came over him and he can't in his right mind stay in the same home with 'that ugly monster.';;
mushroom-story-event.1;Постоялый двор закрывается;Дурные вести расползаются по округе. Умер держатель постоялого двора и все его гости. Молва рассказывает о страшном мертвеце, что выбрался из могилы и напал на них, сея ядовитые споры. Утром солнце его спалило, но погибших, увы, не вернуть.;Bad news today. The innkeeper died along with every guest in his inn. People are whispering about a terrifying undead monster that climbed out of the grave and attacked, spreading death and pestilence. Rising sun burned him down, but his victims will rise no more.;;
stolen_rooster_event.5;Красный петух;Ночью на дальних фермах случился пожар. Говорят, одна хозяйка другую в воровстве уличила. Забрала своего петуха золотого, а взамен «красного» оставила. Местный граф осудил поджигательницу и обложил двойным налогом.;A fire on one of the remote farms this night. They say a woman found who stole her golden rooster. She took it back, leaving some hot coals in thief's barn in its place. She was given a hundred lashes and will pay double tax from hereafter.;;
stolen_rooster_event.4;Memento mori;Утром до вас дошли слухи, что хозяйку богатой фермы нашли околевшей в поле. Все ее хозяйство перешло ушлой соседке. Везет же кому-то!;A rich farm-owner was found dead in the field. Her farm went to her crafty neighbor. Some people are just lucky like that.;;
GhostAtTheMill;;Поговаривают, что на мельнице завелось привидение. Церковь пришлет кого-то проверить этот слух.;Rumor has it that the mill is haunted. The church will surely send someone to investigate.;;
old_knight_event.3;Шляпа и шлем;Старый рыцарь, проигравший в финальной сшибке, во всеуслышание заявил, что его околдовала ведьма. Его подняли на смех, поэтому он преклонил колено перед старшим инквизитором, поклявшись искоренить чернокнижие в королевских землях.;An old knight lost the final joust of the tourney. He publicly declared a witch put a spell on him. He was ridiculed yet unmoved in his conviction, so he bent the knee to the grand inquisitor and swore an oath to eradicate the sorcerous corruption in king's realm.;;
SoldierSleepForgot;;Отряд солдат, присланный на борьбу с местными разбойниками, просидел весь день в трактире, будучи не в состоянии выполнять приказ. Братва вам благодарна.;Soldiers, sent here to hunt bandits, spent the whole time in local tavern instead. Homeboys are thankful.;;
SoldierDied;;В местном лесу перебили всех солдат, отправленных на поиски бандитов. Последние становятся все сильнее, и вы надеетесь, что они не забудут про вашу помощь.;Soldiers went into the woods and not a single one came back, all slain by the bandits they were sent to hunt. You can only hope the latter will remember your kindness.;;
TaxCollectorWasRobbed;;Налоги не доехали до казны – сборщик был найден мертвым на дороге. Король обещает найти и покарать всех, кто в этом виноват. Вместе с тем, ваш кошель стал тяжелее.;The peasant's money never reached the lord – the tax collector has been found dead on the road. The furious lord promises to find and punish the guilty. Meanwhile your pouch got a little bit heavier.;;
Painter_2_Perception;;В городе проходит новая выставка работ Гоффридуса. Он на пике популярности, но некоторые жалуются на дискомфорт. Им кажется, что некоторые картины постоянно смотрят на них, где бы они ни были.;An art exhibition in the city: Goddfridus' new works. He's at the peak of popularity but some people complain they feel unease. They paintings – they say, – are watching <i>them</i>.;;
Painter_2_Beauty;;Работы Гоффридуса ценятся все больше. Один из лордов выкупил картину, чтобы жениться на ней, а другой – скончался от истощения, когда не смог оторваться от нее даже ради еды.;Goddfridus' paintings are growing in popularity and price. A scandalous lord even married one, another man died of exhaustion because he couldn't tear himself away.;;
Painter_2_Memory;;Возможно, это новый вид творчества, но новые работы Гоффридуса сильно напоминают какую-то мазню. Среди знати находятся некоторые знатоки, которые ищут глубинные смыслы и темы, но большая часть простого люда не оценила смену стиля. Сам художник не может никак это описать, отвечая лишь «агу?»;Maybe it's a new art style, but Goddfridus' recent paintings look more like a daub. Some noblemen see deep meaning and provoking themes in them but common people are not amused. The artist himself comments 'Goo goo ga ga!';;
Painter_2_Chameleon;;Гоффридус снял огромный зал и проводит выставку новых работ. Но посетители не могут найти ни одной картины, как бы художник ни убеждал в том, что они висят рядом. Особо разозленные посетители угрожают «побить этого выдумщика, авось видеть нормально станет».;Goddfridus rented a spacious hall for his new exhibition. Despite his efforts to convince everyone the paintings are right there, people simply can't find them. Several frustrated art connoisseurs even threatened the artist with violence.;;
Bird_Keeper_2_Unlove;;Кошмар во дворце! Королевского сокольничего заклевали его же подопечные. Часть птиц пришлось убить – они нападали и на других людей, чуть не разорвав новорожденного сына короля.;Panic in the palace! The royal falconer was attacked and killed by the birds in his care. Several beast had to be put down – they threatened other people, even coming close to mangling king's newborn son.;;
Bird_Keeper_2_Strength;;Люди в ужасе – расходятся слухи, что королевский сокол притащил с охоты лося без каких-то видимых усилий. Некоторые опасаются, что они могут скоро перейти на людей.;People are afraid. There's a rumor that a royal falcon caught a whole moose without any effort. What if the birds start hunting people next?;;
Bird_Keeper_2_Perception;;Утром вам прислали благодарность из дворца: «Большущее вам спасибо за чудесный отвар! Теперь мои птички с небес даже таракана видят. Я всем расскажу, какая вы замечательная!»;A thank-you letter from the palace in the mail this morning: 'Thank you for that amazing remedy! My birds can see a flea on a hound's tail from the sky. Everyone will know how good you are.';;
Bird_Keeper_2_Clumsiness;;Королевского сокольничего выгнали взашей. Говорят, что его птицы разучились даже летать и опозорили короля, когда тот устроил охоту для гостей из далеких земель.;The royal falconer was banished and exiled. Birds in his care had forgot how to fly and embarrassed the king when his majesty went hunting with foreign officials.;;
Doctor_2_Wake;;Кажется, местный врач решил работать, пока не вылечит весь город – целый день проводит с больными без усталости и отдыха.;It seems the good doctor isn't going to rest while there's at least one sick person left in the city – he's accepting patients day and night without break.;;
Doctor_2_Healing;;Кажется, местному лекарю удалось совершить прорыв в медицине. По крайней мере, по его восторженным крикам, он сможет лечить людей быстрее и лучше. И все благодаря «этой чудесной (и немного жуткой) ведьмочке из пригорода!»;The doctor was heard bragging about a medical breakthrough he'd made – something about faster and better cures for the sick. He didn't forget to mention 'that wonderful (but scary) witch from the outskirts.';;
Doctor_2_Poison_Curse;;Местный лекарь был найден мертвым в своей лаборатории. Судя по всему, он проводил какие-то эксперименты на себе и доэксперементировался. Шепотки разносят, что на его столе нашли склянку с вашим зельем.;The doctor was found dead in his laboratory. A sad result of self-experimentation. Of course someone noticed a vial with one of your potions on his table.;;
Cultist_2;;Кажется, ночью на озере опять что-то происходило. Даже до вас ночной ветер донес странные песни и вой. Утром рыбаки обнаружили на берегу горы мертвой рыбы и водорослей.;Something's brewing at the lake yet again. The wind brings strange wailing songs that wake you in the middle of the night. In the morning the fishermen find piles of dead fish and kelp on the shore.;;
stolen_rooster_event.3;Благодарность;Ночью кто-то оставил на пороге вашей хижины кувшин молока, горшочек с маслом и корзинку яиц. Среди них лежит золотое петушиное перо – на удачу, наверное. Она вам теперь понадобится.;Someone's left a jar of milk, a pot of butter and a basket of eggs on your porch last night. And a single golden feather. Maybe it'll bring you luck – you surely need some.;;
FisherKissedTheFrog;;Дети, играя на речке, увидели, как один рыбак целовал лягушку, и быстро разнесли эту новость по деревне. Рыбак пытался все отрицать, но его репутация уже была подмочена.;Kids playing on the river bank saw a fisherman kissing a frog and told everybody. He tried to deny it but his story doesn't hold much water.;;
FoolGrateful;;Дурачок благодарен вам за помощь с проказами. Он разносит по всей округе вести о том, какая вы хорошая и понимающая.;The fool is thankful for your help with his pranks. He tells everyone how kind and understanding you are.;;
